Index,Needs review?,Status,Need to do,Event ID,Appellate case number,Court Name,Court,State,County,County name,Opinion date,Opinion year formula,Opinion year,Defendant Last Name,Defendant First Name,Defendant,Defendant race,Conviction year,Crime category,Top level crime,Additional crimes,Domestic violence case?,Crime against child?,Victim gender,Sentence,Capital case?,Year of Alleged Error,Alleged error,Allegation graf,Court Holding,Court holding graf,Keyword used,Judge,Appellate Judge,Additional judges,Addtl judges,head prosecutor,Chief Prosecutor,Additional prosecutors,Additional Appellate Prosecutor,Appellate defense,Defense attorney,Notes,Document source,Attachments,Citation (from top left of decision: 20YY-Ohio-#### only),NRE case?,Higher court Type,Higher Court decision,Remanded for?,Appealed further search date,No further appeals,Does Not Meet Standards,Which standard does it not meet?,UNI,Professor,Original entry,Fact-checker,Fact-check notes,Reporter name,Review request details,Outlet name,Westlaw export,Trial case number,Search Word (from Westlaw export),Lookup,Case number clean,State searches OH,Found trial documents?,Trial document source,Trial prosecutor/s,Trial document notes,Trial prosecutor,State export copy,Giglio mentioned? (Brady cases),Type of Evidence (Brady cases),Brady Holding,Defendant gender,Allegation page number,Allegation paragraph number,Holding page number,Holding paragraph number,Judges,Trial Prosecutor Confirmed,Trial Prosecutor Confirmation Method
115-CARTER,,,"defendant race,victim info",115,104653,"Court of Appeals of Ohio, Eight Appellate District County of Cuyahoga",Eighth District Court of Appeals,Ohio,Cuyahoga,Cuyahoga  ,2017-06-29,2017,2017,CARTER,ALTON,Alton Carter,Black,2016,Sexual violence,Rape,"Attempted rape, felonious assault, kidnapping, and misdemeanor assault. ",,,,"Carter was sentenced to six years on the kidnapping conviction, to be served concurrently to a six-month sentence on the assault conviction.",,2017,Other or unknown,"The trial court violated appellant’s rights under the Fifth, Sixth, and Fourteenth Amendments of the Constitution of the United States by allowing the state to present evidence of statements elicited from appellant by police officers after he was accused of rape and while he was being detained by police officers without first advising him of his constitutional rights and obtaining a valid waiver from him.",No error,The first assignment of error is overruled.,harmless error,LARRY A. JONES,Larry A. Jones Sr.,"EILEEN A. GALLAGHER, MELODY J. STEWART","Melody J. Stewart,Eileen A. Gallagher",Michael C. O’Malley,Michael C. O'Malley,,Jennifer King,,,"The court overruled all alleged errors and stated the case ""remanded to the trial court for execution of sentence."" ",https://www.supremecourt.ohio.gov/rod/docs/pdf/8/2017/2017-Ohio-5573.pdf,"""_State v_ Carter, 2017-Ohio-5573.pdf (https://v5.airtableusercontent.com/v3/u/40/40/1745100000000/DAXJHfzCleQ7X9YXqBeUAQ/xleVDhWJ4P0rmhdCSXPrcdhdDgYJn28fRdpucj8OEL2aTuUxzwNT8q_I7_e_j4n4iXxpf1g2l8WUKET8CYwt9fvK0n0gx6NkQ_0cpF44JvqiTq4w785VluoTZrCEQ-RmiK_3-1ggll4dAyaBrXEFLglmEzi10EL1yU2Gs0x-mHE/RaOvnAd_H5DhcFFDQttP_xBFe4XeBNRHEQhh5fDuoGg)""",2017-Ohio-5573,,,,,,,checked,No allegation of prosecutor misconduct,mr4130,Cobb,Student,Taylor Eldridge,No allegation of prosecutor misconduct in this case,,"This case had nine alleged errors. Through this form, I was only able to submit information on the first one. ",,State v. Carter,CR-15-598676-A,Harmless error,Harmless error,104653,State v. Carter,,,Steve McIntosh; Jennifer King; Anna Faraglia,,Jennifer King,,,,,Male,8,4,10,1,,,
122-Lemons,,Fact-check complete,,122,104481,EIGHTH APPELLATE DISTRICT,Eighth District Court of Appeals,Ohio,Cuyahoga,Cuyahoga  ,2017-07-20,2017,2017,Lemons,Anthony,Anthony Lemons,,1995,,Murder,Attempted murder,,,,15 years to life,,2016,Brady violation,"""1. The trial court erred when it concluded that [he] was not a wrongfully imprisoned individual on May 2, 2016.
2. The trial court erred when it denied [him] leave to amend his complaint on November 20, 2015.""

**

{¶145} The Supreme Court’s holding in Johnston is not at issue in the present appeal. Instead, Lemons relies on the Supreme Court’s statement in Johnston where it declined to review Johnston’s claim that he was a wrongfully imprisoned person because the state continued to withhold exculpatory evidence from him after he was sentenced, and thus, there was an ongoing Brady violation — an ongoing “error in procedure” that continued after sentencing and imprisonment. Based on the Supreme Court’s statement, Lemons asserts that the high court has not yet decided the issue of whether a person is a wrongfully imprisoned individual if there was an error in procedure that began before sentencing, but continued after sentencing and imprisonment, that resulted in his or her release. Lemons maintains that in the present case, the state’s ongoing Brady violation amounted to “an error in procedure” that may have originated before he was sentenced, but continued to occur “subsequent to sentencing and during or subsequent to imprisonment” that ultimately resulted in his release. Lemons claims that the state failed to provide exculpatory evidence to him on several occasions subsequent to his sentencing, including when he made a public records request in 2001, until he finally received it when he made “another public records request in 2008.” Therefore, Lemons argues that the trial court should have permitted him to amend his complaint to reassert this claim.

**

{¶147} Lemons further asks this court to address the merits of this issue because sufficient facts were established at trial and there are no material facts in dispute. We agree. The issue of whether there was an error in procedure subsequent to Lemons’s sentencing and during or subsequent to his imprisonment that resulted in his release is a question of law. The facts relating to this issue are not in dispute. The question of law is whether an ongoing Brady violation that continues after a claimant was convicted, sentenced, and sent to prison — meaning the state continues to withhold material exculpatory evidence after the defendant’s trial is over — amounts to an “error in procedure” that occurs “subsequent to sentencing or during and subsequent to imprisonment.” We conclude that an ongoing Brady violation that continues after a defendant was sentenced and is in prison is an “error in procedure” within the meaning of R.C. 2743.48(A)(5).",,"{¶146} We agree with Lemons that the trial court abused its discretion when it denied Lemons’s motion to amend his complaint. There is no evidence of bad faith or undue delay. Moreover, despite its argument to the contrary, the state was not prejudiced by the delay because this argument is merely a question of law — and one that the state thoroughly argued against to the trial court and to this court.

**
{¶151} Thus, after reviewing the law and relevant facts on this issue, and in accordance with App.R. 12(B), we render judgment in favor of Lemons, concluding that he established as a matter of law that he is a wrongfully imprisoned individual under the first prong of R.C. 2743.48(A)(5) because of ongoing errors in procedure that continued to occur long after he was sentenced and sent to prison, which ultimately resulted in his release.

{¶155} We sustain Lemons’s second assignment of error because we agree with him that the trial court abused its discretion when it did not allow him to amend his complaint to reinstate his claim that he was a wrongfully imprisoned individual because he was released from prison due to a procedural error that occurred subsequent to his sentencing and imprisonment under the first prong of R.C. 2743.48(A)(5).
{¶156} We further agree with Lemons that this court can address the merits of his procedural-error claim because we find it to be a question of law that was fully addressed and argued by both parties to the trial court and to this court. In doing so, we agree with Lemons that he established he was a wrongfully imprisoned individual within the meaning of the first prong of R.C. 2743.48(A)(5) because he was released from prison due to an ongoing Brady violation that continued after he was sentenced and sent to prison.
",Brady v. Maryland,MARY J. BOYLE,Mary J. Boyle,"Anita Laster Mays (Concurred), Frank D. Celebrezze (Concurred in part and dissented in part)","Anita Laster Mays,Unnamed record",Michael DeWine,Michael DeWine,,Debra L. Gorrell,"David B. Malik, Sara Gedeon, Kevin M. Spellacy McGinty, Hilow & Spellacy Co., L.P.A.  Jennifer Branch, Alphonse A. Gerhardstein Gerhardstein & Branch Co., L.P.A.  ",,"The court is holding that Lemons was wrongfully imprisoned due to an error in procedure, being an ongoing Brady violation. This specific appeal is not the Brady violation error allegation, but rather the ruling that he was wrongfully imprisoned. The court held that the case be remanded for judgement from the trial court that he was wrongfully imprisoned. ",https://www.supremecourt.ohio.gov/rod/docs/pdf/8/2017/2017-Ohio-6880.pdf,"""Lemons v_ State, 2017-Ohio-6880.pdf (https://v5.airtableusercontent.com/v3/u/40/40/1745100000000/X-D_iyb8uz8J0CR5JJAWpw/hZ3xDxort9oZKTmLLkFi3tdJbL9fqIz54VDGOGsc8rGq8sKizEZJza7HoDDyiwb96c4H3YKXSQL14E64K_2QKzrqs2ftzQbrWTnXwtPNr45lrZ674uC8tzVRAhtSfGkrij2vcVpTDWADglO3arituT9R9k0K5yOmdYNv3-w-ILk/w5CvoTN6POtzKUKgPiGyT9bDyyoHeZWeRUciBGeaOGE)""",2017-Ohio-6880,,,,,,,checked,Trial is before 2001,mr4130,Cobb,Student,Jake Belford Kincaid,"allegation against court, not state",,I'm not sure if my categorization of the court holding is correct. ,,Lemons v. State,CV-15-839878 ,Brady v. Maryland ,Brady v. Maryland ,104481,,,,,,,,,,,,"51, 52","145, 147","51, 53-54","146, 151, 155, 156",,,
123-Lemons,,Fact-check complete,,123,104481,EIGHTH APPELLATE DISTRICT,Eighth District Court of Appeals,Ohio,Cuyahoga,Cuyahoga  ,2017-11-16,2017,2017,Lemons,Anthony,Anthony Lemons,,,,,,,,,,,,,,,,Brady v. Maryland,MARY J. BOYLE,Mary J. Boyle,"ANITA LASTER MAYS, 
FRANK D. CELEBREZZE","Anita Laster Mays,Unnamed record",,,,,,,"""After review, we overrule Lemons’s first assignment of error, but sustain his
second assignment of error. We therefore reverse the judgment of the trial court and remand for further proceedings.""",https://www.supremecourt.ohio.gov/rod/docs/pdf/8/2017/2017-Ohio-8584.pdf,"""Lemons v_ State, 2017-Ohio-8584.pdf (https://v5.airtableusercontent.com/v3/u/40/40/1745100000000/v0B2iS7USfIMe_xRvcudHg/ixvbRxRuoeFQ0NMkhJx3iLQmvmvoVrJkGOKBZvSk4vdjoj7vIuG_nLNlF4O2uZc9CJumLVKM7zMUqQ_4poKws_vi2ADfpoZ3GNmo5HlDpx8LYLHOlWMWeX1VbbWaV5rPvHe0UpUNLE1JiO7DgAzU93DBeOdNVyXfjhVZzuaROJg/Q5E5vxrWfROcMnlmg8ttbRjciJ8ckBJUEbrW_YjF4BU)""",2017-Ohio-8584,,,,,,,checked,"""Allegation of error is against the court, not the prosecutor/state""",mr4130,Cobb,Student,Taylor Eldridge,"allegation against court, not state",,,,Lemons v. State,CV-15-839878,Brady v. Maryland ,Brady v. Maryland ,104481,,,,,,,,,,,,,,,,,,
146-Lee,,Needs fact-check,"defendant race,victim info",146,104682,EIGHTH APPELLATE DISTRICT COUNTY OF CUYAHOGA,Eighth District Court of Appeals,Ohio,Cuyahoga,Cuyahoga  ,2017-04-20,2017,2017,Lee,Ramel,Ramel Lee ,Black,2016,Murder,Murder,"Attempted murder, felonious assault and discharging a firearm near prohibited premises.
",,,,15 to life,,2016,Summation,"Lee asserts that the prosecuting attorney made improper statements
during his closing argument, including asserting that Lee had no reason to go to the scene if “one is a J-Park member,” that Lee has a “death taxi,” that the area had “ATM bodies that have been killed,” and that it didn’t matter if the victim fired first.
",No error,"Beginning with the prosecuting attorney’s statement that Lee had no reason to go to the scene if “one is a J-Park member,” we note that while such statement, standing alone, would not be a proper argument, in this particular instance, it was a fair comment on the evidence. Lee’s own statement to police indicated that it would not be safe for J-Park members to go to ATM Jack Boyz territory, and a J-Park member would not go there unless he was looking for trouble. In addition, the testimony of S.L. demonstrated that if a J-Park member goes into ATM Jack Boyz territory, he would be there “to fight or something like that.” Accordingly, we find no prejudicial error in connection with this portion of the argument.
","harmless error,prosecutorial misconduct",PATRICIA A. BLACKMON,Patricia Ann Blackmon,"FRANK D. CELEBREZZE, JR., J.
LARRY A. JONES, SR., J., CONCUR
","Larry A. Jones Sr.,Unnamed record",Michael C. O’Malley,Michael C. O'Malley,,,P. Andrew Baker,P. Andrew Baker,"Second of two appeals filed by Mr. Lee - the first was CR-15-595400-C from 2016. In this appeal Mr. Lee presented 7 allegations of error, all of which were overruled.",https://www.supremecourt.ohio.gov/rod/docs/pdf/8/2017/2017-Ohio-1449.pdf,State v. Lee 2017-Ohio-1449.pdf (https://v5.airtableusercontent.com/v3/u/40/40/1745100000000/Zszeuq69bIBYwIOujUOGOA/eaHy77BW2ciE84LCbbM-BdfM3mkYcqIbonB5PgtnOpxyvZGzGUUPU7PyRaBm_ffRLDtCTA0es0Ztia9DvXH0F7wd43poyH0DtMl_StRKJMkDMoJ4KeqNGOC19JPnZISqtfYrtSHIvP5TVugAf1AmniKx8LYFhpXjVupEVdEY-YE/w7tE59XiRarwRiijUvJ1tsZzEndBXN-8zQyQCevfUCk),2017-Ohio-1449,,,,,,,,,mk4545,Cobb,Student,Taylor Eldridge,,,,,State v. Lee,CR-16-604198-A,Harmless error;Prosecutorial Misconduct,Harmless error;Prosecutorial Misconduct,104682,,,,,,,,,,,Male,20,47,49 - 53,20,,,
149-Pierce,,,,149,105389,"Court of Appeals of Ohio, Eighth Appellate District",Eighth District Court of Appeals,Ohio,Cuyahoga,Cuyahoga  ,2017-11-16,2017,2017,Pierce,Johnnie,Johnnie Pierce,,2016,Assault,Felonious assault,"Vandalism, escape, assault, two counts of harassment, resisting arrest",,,,Three years,,2016,Jury selection,"{¶9} On January 20, 2017, Pierce filed the instant appeal challenging his convictions and the trial court’s sentence. He assigns four errors for review:
I. [Pierce] was denied due process of law when he was sentenced for a felony of the third degree when there was no determination by the jury as to what the underlying offense was for the offense of escape.
II. [Pierce] was denied due process of law when the court failed to state [Pierce’s] Batson challenge.
III. Defense was denied due process of law when the court, on its own, did not instruct the jury on intoxication.
IV. [Pierce] was denied due process of law when he was convicted of harassment by an inmate.",No error,"{¶24} Based on the foregoing analysis, we find the mandates of McDonald and Pelfrey to be controlling. As such, we consider only the verdict form itself in determining whether there was compliance with R.C. 2945.75. Pelfrey, 112 Ohio St.3d 422, 2007-Ohio-256, 860 N.E.2d 735, at ¶ 14; McDonald, 137 Ohio St.3d 517, 2013-Ohio-5042, 1 N.E.3d 374, at ¶ 17. It is evident that the dictates of the statute were not followed. The jury verdict form did not state the
degree of the escape offense, nor did it state the most serious offense for which Pierce was under detention when he committed the escape offense.
{¶25} Accordingly, Pierce’s conviction for escape should be reduced to a fifth-degree felony in order to conform to the jury’s verdict form. Pierce’s first assignment of error is sustained.
{¶35} After reviewing the record, we cannot say that the trial court’s denial of defense counsel’s Batson challenge was clearly erroneous. After defense counsel objected to the state’s removal of prospective Juror 6, the trial court thoroughly reviewed the Batson three-part test and gave the prosecution an opportunity to provide its reasons for excusing the juror. The prosecutor provided permissible race-neutral justifications for exercising its peremptory
challenge. In denying defense counsel’s Batson challenge, the trial court evidently concluded that Pierce failed to prove purposeful racial discrimination. Accordingly, we defer to the trial court’s resolution of defense counsel’s Batson challenge.
{¶44} Based on the foregoing analysis, we cannot say that the trial court committed plain error by failing to provide the jury with an instruction on intoxication. Accordingly, Pierce’s third assignment of error is overruled.
{¶52} The testimony of Officers Davis, Petitt, and Hoover, if believed, is sufficient to establish that Pierce caused the officers to come into contact with his blood by expelling the spit and blood in his mouth upon the officers. Accordingly, Pierce’s convictions for harassment by an inmate are supported by sufficient evidence.
",Batson v. Kentucky,"Frank D. Celebrezze, Jr. ",Unnamed record,Kathleen Ann Keough and Sean C. Gallagher,"Kathleen Ann Keough,Sean C. Gallagher",Michael C. O'Malley,Michael C. O'Malley,,,"Paul A. Mancino, Jr. , Mancino Mancino & Mancino","""Paul A. Mancino, Jr.""","The defendant raised four allegations of four errors, one of which was found to be harmful. Specifically, the jury verdict form failed to state the degree of the defendant's escape offense, prompting the court to rule that the defendant's conviction for escape should be reduced from a third degree to a fifth degree offense. ",https://www.supremecourt.ohio.gov/rod/docs/pdf/8/2017/2017-Ohio-8578.pdf,"""State v Pierce, 2017-Ohio-8578.pdf (https://v5.airtableusercontent.com/v3/u/40/40/1745100000000/W9Evy91w3Xp2lw9n7qL1iw/7lqjYhXst2BB1MM3K8_3SBXyqaM51OR8WPAP89gY0O1qspkxOg3SZpnqjm3TXOlIQIgYNSN52xU9uDCmaUF-_nsF6KTQSUGY_N7p73zwdZAPVn31f5486U1KOqFkrlo43Od5gJEuD5k0Zjdu8fl8cqoWLFZMq7SyKoEGYDuVYTo/GSEm6cZW2_d9o33DlaAZ0fXNmpt6ruh9g2RolqlOgWM)""",2017-Ohio-8578,,,,,,,,,eaj2146,Cobb,Student,Taylor Eldridge,"There is an allegation of improper jury selection, which the court dismisses. ",,,,State v. Pierce,CR-15-596666-A ,Batson v. Kentucky,Batson v. Kentucky,105389,State v. Pierce,,,,,,,,,,,5,19,"10, 15, 17","24-25, 35, 44, 52",,,
177-Carter,,,"defendant race,victim info",177,104874,EIGHTH APPELLATE DISTRICT COUNTY OF CUYAHOGA,Eighth District Court of Appeals,Ohio,Cuyahoga,Cuyahoga  ,2017-12-07,2017,2017,Carter,Demetrius,Demetrius H. Carter,Black,2017,Sexual violence,rape,kidnapping and gross sexual imposition,,,,8 years,,2017,"Other or unknown,Examination of witnesses","Appellant  was  denied  due  process  and  a  fair  and  impartial  trial  as  guaranteed  by  the  Fifth,  Sixth,  and  Fourteenth  Amendments  of  the  United  States  Constitution  and  Article  1,  Section  16  of  the  Ohio  Constitution based on prosecutorial misconduct; ",Did not reach anything/ reverses on other grounds,"{¶23} The remaining assignments of error are moot pursuant to App.R. 12(A), and therefore a determination on those issues are not required.   {¶24} Judgment is reversed and remanded. ","harmless error,prosecutorial misconduct",ANITA LASTER MAYS,Anita Laster Mays,"MARY EILEEN KILBANE
EILEEN T. GALLAGHER","Mary Eileen Kilbane,Eileen T. Gallagher",Michael C. O’Malley,Michael C. O'Malley,,,Susan J. Moran,Susan J. Moran,N/A (see court holding graf),https://www.supremecourt.ohio.gov/rod/docs/pdf/8/2017/2017-Ohio-8864.pdf,"""State v_ Carter 2, 2017-Ohio-8864.pdf (https://v5.airtableusercontent.com/v3/u/40/40/1745100000000/TcO7T_AxNCEQIWZODbNakQ/DubaNJHOazufvf7XOOYUC9jOzYtQXLQBY_6eJwUTX4xuSEa85vGVro1veIhhrFdDoZNss3wT4I8L9aRVXAJViVPGDBrJj0S-ug7imOUlK3j5dv37qINARHtj9t8HyTl7RRssqRjOMWILhQq3aYiI0hniaVARN_zJ26efgs0874Y/zqmBroe7yO_tlf_aILjDceDWNtKWIgijoSVIPtBMLjg)""",2017-Ohio-8864,,,,,,,,,je2618,Cobb,Student,Taylor Eldridge,"Updated court holding to ""did not reach anything"" since the court found there had been a harmful error made by the trial court, it reversed on those grounds, and did not review the prosecutorial misconduct allegation in depth.",,Alleged error. (Just want to double check.) ,,State v. Carter,CR-16-603056-A,Harmless error;Prosecutorial Misconduct,Harmless error;Prosecutorial Misconduct,104874,,,,,,,,,,,Male,6,9,13,23,,,
274-Harris,,,"victim info,trial documents",274,104329,Court of Appeals of Ohio,Eighth District Court of Appeals,Ohio,Cuyahoga,Cuyahoga  ,2017-05-11,2017,2017,Harris,Byron,Byron Harris,Black,2015,Murder,Aggravated murder,"murder, felonious assault, discharge of a firearm on or near prohibited premises, having a weapon while under disability.",,,,Life with a possibility of parole after 29 years,checked,2015,Summation,"In  his  fifth  assignment  of  error,  Harris  contends  that  the  prosecutor  committed  prosecutorial  misconduct  by  comparing  his  personal  experiences  to  the  evidence at trial during closing arguments.",No error,"Nevertheless,  we  find  that  the  prosecutor’s  isolated  comment  was  not  prejudicial  and  did  not  amount  to  plain  error.    Furthermore,  the  trial  court,  immediately  after  the  state  ended  its  closing  argument,  instructed  the  jury  that  closing  arguments  are  not evidence.    It is presumed that the jury followed this instruction. 

{¶88} Accordingly, the prosecutor did not engage in misconduct during his closing argument  because  the  remarks  did  not  rise  to  the  level  of  misconduct  that  would  substantively deprive Harris of a fair trial.    Having found that the prosecutor’s comments did not constitute misconduct, Harris’s defense counsel was, therefore, not ineffective for failing to object to them.    The fifth assignment of error is overruled. ",prosecutorial misconduct,Kathleen Ann Keough,Kathleen Ann Keough,"Mary Eileen Kilbane, Frank D. Celebrezze Jr.","Mary Eileen Kilbane,Unnamed record",Michael C. O’Malley,Michael C. O'Malley,,,Rick L. Ferrara,Rick L. Ferrara,there are none,https://www.supremecourt.ohio.gov/rod/docs/pdf/8/2017/2017-Ohio-2751.pdf,"""State v_ Harris, 2017-Ohio-2751.pdf (https://v5.airtableusercontent.com/v3/u/40/40/1745100000000/RIZHwCPUqXGNpEHTWnF5gg/idfvOPYrdqOLPrUBDIMturNJf7czVYMOnbpGXCxMwJN5-FiSYK4TIDItOoEQqOAvpb40ggQCFpvq1ttT3MhooyNTbaehfQLHK4VzOV0pa-Pcd3q4fDl5fwvQFjsH0LFQcNUPXrMt8_-PO5Cj2e6EfV8pU5f-f4Lf8NhfYcvKmCU/2JQWsn1CuXII-sL_IC6ntZZFFkZNwqn4nOwZkG08iNA)""",2017-Ohio-2751,,,,,,,,,JJA2165,Cobb,Student,Taylor Eldridge,Updated allegation type and graf; holding type and graf.,,,,State v. Harris,CR-14-589543-A,Prosecutorial Misconduct,Prosecutorial Misconduct,104329,State v. Harris,,,,,,,,,,Male,30,81,32,87,,,
320-Mack,,Fact-check complete,,320,101261,Eight Appellate District County,Eighth District Court of Appeals,Ohio,Cuyahoga,Cuyahoga  ,2017-11-02,2017,2017,Mack,Clarence,Clarence Mack,Black,1991,Murder,Murder,Car theft,,,,Death penalty ,checked,2013,,"Other: Untimely dealing with successive postconviction relief petitions: ""{¶10} When dealing with successive postconviction relief petitions, the applicant
has a heightened pleading requirement. R.C. 2953.23 governs successive or untimely petitions. It provides that a court may not entertain an untimely or successive petition unless the petitioner is able to demonstrate each of the following:""

Brady: ""{¶30} Appellant also claims the state withheld exculpatory evidence or evidence that could have been used to impeach Willis, a key witness. During the federal habeas proceedings, the state produced material that appellant claims was not made available prior to or during trial. He argues this evidence would have made a difference at trial and requires the court to vacate his convictions and sentence and retry him.""

Discovery: ""{¶30} Appellant also claims the state withheld exculpatory evidence or evidence that could have been used to impeach Willis, a key witness. During the federal habeas proceedings, the state produced material that appellant claims was not made available prior to or during trial. He argues this evidence would have made a difference at trial and requires the court to vacate his convictions and sentence and retry him.""",,"{¶69} Judgment affirmed.
It is ordered that appellee recover of appellant costs herein taxed.
The court finds there were reasonable grounds for this appeal.
It is ordered that a special mandate issue out of this court directing the common
pleas court to carry this judgment into execution.",prosecutorial misconduct,"FRANK D. CELEBREZZE, JR., JUDGE",Unnamed record,,,Michael C. O'Malley,Michael C. O'Malley,"Katherine Mullin, Joseph J. Ricotta","Joseph John Ricotta,Katherine Mullin","John B. Gibbons, Timothy F. Sweeney",,This appeal comes after multiple others since the original conviction in 1991. ,https://www.supremecourt.ohio.gov/rod/docs/pdf/8/2017/2017-Ohio-8397.pdf,"""State v_ Mack 2, 2017-Ohio-8397.pdf (https://v5.airtableusercontent.com/v3/u/40/40/1745100000000/dQvLiK_qGnI9wXvirFr7Cw/CfK6q9R5pwnXP0SciNu0HWL7uXi6rt4J0K5GetHWSEI8ozCgRDpCSbEGCS91GO539H4c-PS7t02YFJ6SuV45LQFFZzcPrJPHVjwGBdYHQLZcq55XVWVHW9ho5J9_Ej67okvKfMfu7ohmoBUDUgwmw9uuNMhMQ9PX-mMeUU7fLcY/8hKR-YpAyO2b2iLIWh7boCHxWZQO9aoIBkMmZNKPBwk)""",2017-Ohio-8397,,,,,,,checked,,jtb2183,Cobb,Student,Jake Belford Kincaid,We should ignore vacated opinions right? (Should be changed to doesn't meet standards then. ),,"The court holding. The language used (""It is ordered that a special mandate issue out of this court directing the common pleas court to carry this judgment into execution."") is unclear to me as to whether or not the conviction was overturned. ",,State v. Mack,CR-91-262888-A,Prosecutorial Misconduct,Prosecutorial Misconduct,101261,,,,,,"Joseph John Ricotta,Katherine Mullin",,,,,Male,"Other: 11, Brady: 18, Discovery: 15","Other: 10, Brady: 30, Discovery: 21",34,69,,,
