438-Houston,checked,,defendant race,1438,16AP-157,Tenth District Court of Appeals,Tenth District Court of Appeals,Ohio,Franklin,Franklin  ,2017-03-28,2017,2017,Houston,Zachary W.,Zachary W. Houston,,2016,Assault,felony domestic violence,,checked,,Female,30 months in prison,,2015,Examination of witnesses,"{¶ 23} B. Third Assignment of Error—Whether Prosecutorial Misconduct Deprived Zachary of a Fair Trial.

{¶ 24} ""To evaluate allegations of prosecutorial misconduct, we 'must determine (1) whether the prosecutor's conduct was improper and (2) if so, whether it prejudicially affected [the defendant's] substantial rights.' "" State v. Thompson, 141 Ohio St.3d 254, 2014-Ohio-4751, ¶ 162, quoting State v. LaMar, 95 Ohio St.3d 181, 2002-Ohio-2128, ¶ 121. Zachary argues that the prosecutor engaged in misconduct by ordering a witness not to speak to an investigator hired by the defense. (June 9, 2016 Zachary Brief at 11-13.) ",No error,"{¶ 25} A witness in Ohio has a right to refuse to submit to a pretrial interview when it is his or her own decision and he or she is not compelled by subpoena or other lawfully binding notice. State v. Zeh, 31 Ohio St.3d 99, 102-03 (1987). However a prosecutor may not obstruct access to a witness or advise the witness not to cooperate with the defense. Id.; State v. Lundgren, 11th Dist. No. 90-L-15-140 (Sept. 1 1993) ("" 'A prosecutor should not discourage or obstruct communication between prospective witnesses and defense counsel. It is unprofessional conduct for the prosecutor to advise any person or cause any person to be advised to decline to give to the defense information which such person has the right to give.' ABA Standards for Criminal Justice, The Prosecution Function, Standard 3-3.1(c)"")",prosecutorial misconduct,Jennifer Brunner,Jennifer Brunner,"Betsy Luper Schuster, Timothy S. Horton","Betsy Luper Schuster,Timothy S. Horton",Ron O’Brien,Ron O'Brien,Kacey S. Chappelear,Kacey Chappelear,Stephen T. Wolfe,,"This is a domestic violence case. The defendant claimed the witness, the woman he is accused of beating, said she refused to speak to a private investigator hired by the defense attorney because the prosecutor told her not to. If the prosecutor did in fact tell her not to, that would be improper conduct, but she later testified in court that she made that up out of fear as an excuse as to why she didn't want to speak to the investigator who she knew was working for a man she said attacked her.",,2017-Ohio-1122.pdf (https://v5.airtableusercontent.com/v3/u/40/40/1745100000000/VpbLM1TUJx7xIRqZ7dDSAg/Juoub_j5Pcs_HTGly5KNbvwBV6JpPJfj9vkRj_K_vG0XWQ7nO0Bz_6gVa_a9p30EfztXQ8NRjoq3hTiDjYCEoUI1NNuYZyQHQUifL4DMI6qycUrJ-Kirg6lTPuVg-EP3tQNYeQReq7k-SSK_NN8bXNArIGFbBHKQQvqW7eIgpKY/6-YFLCo5l8ux-54bn8AAa4GGaC_RtSUc1_Qy8mjxn94),2017-Ohio-1122,,Ohio District Court,Affirmed,,,checked,,,,,,Christopher F Neville,,Curtis Brodner,Double check the alleged error happened in witness examination,CJI,,15CR-2636,,,16AP-157,,,,,,,,,,,,8,"23, 24",8,25,,,
448-Hannon,checked,Fact-check complete,,1448,15 CA 0908,,Seventh District Court of Appeals,Ohio,Carroll,Carroll  ,2017-03-31,2017,2017,Hannon,Harriett Lucinda,Harriett Lucinda Hannon,,,,,,,,,,,,,,,,harmless error,,Gene Donofrio,,"Cheryl L. Waite,Mary DeGenaro",,,,,,,This is a civil case -- a lawsuit. Doesn't meet standards.,,2017-Ohio-1261.pdf (https://v5.airtableusercontent.com/v3/u/40/40/1745100000000/v4N2yciq2jFlnbYZVnE_zA/qZ5IfZB09-By2tmbPAsUoja6l40YjFwIgMTWhAcvhGfvNCB3rTRBQZlxLji1vNcDEOTKX_uUUwfPMHnzS0xz8cYKIm-kkOsLcNmyQpGiKHjuwsDayRdwL63asEnl_a94Tmy_6tM5gQ7Iif1ziPzwqL5MGRqCQGRiBbZMTuBy3Lw/FTKC1MoZ5bsFzDwtbwD9Pzq0YiJnjOI2RwJ7iKgaNu4),2017-Ohio-1261,,,,,,,checked,Case is not criminal,,,,Christopher F Neville,,Curtis Brodner,,,,,,,15 CA 0908,,,,,,,,,,,,,,,,,,
449-Sanchez-Garza,checked,Fact-check complete,"link Prosecutor,trial prosecutor,defendant race",1449,CA2016-02-036,Twelfth District Court of Appeals,Twelfth District Court of Appeals,Ohio,Butler,Butler  ,2017-04-03,2017,2017,Sanchez-Garza,Geraldo J.,Geraldo J. Sanchez-Garza,,,Sexual violence,sexual imposition,,,checked,Female,"60 days in jail (suspended), 3 years community control, registered as sex offender",,,Examination of witnesses,"{¶ 42} Garza contends that the state committed prosecutorial misconduct and denied him a fair trial when it elicited testimony from H. and Officer Leist regarding their opinions about the victim's credibility. In addition, Garza contends the state introduced evidence that Garcia exercised his constitutional right to remain silent as proof of guilt. Garza admits that he only objected to some of these claimed errors.  

{¶ 50} Towards the end of his testimony on direct examination, the state asked Officer Leist whether he spoke with Garza. Leist stated that he attempted to set up a meeting with Garza and his wife but that neither showed and later he had contact with an attorney stating that Garza would not be interviewed. Officer Leist also testified that on the day of the arrest he asked Garza if he would like to make a statement after being read his Miranda rights. Officer Leist confirmed that Garza did not make a statement. Garza did not object to any of this testimony. If the state violated Garza's constitutional rights under the Fifth Amendment, then we must conclude that the constitutional error was harmless beyond a reasonable doubt to sustain Garza's conviction. See Chapman v. California, 386 U.S. 18, 87 S.Ct. 824, paragraph two of the syllabus (1967).",Harmless error,"¶ 51} Unquestionably, this line of inquiry by the prosecutor was highly improper and constituted prosecutorial misconduct. However, we find the prosecutor's misconduct was harmless beyond a reasonable doubt. That this was a bench trial again weighs most heavily in our analysis. We can generally presume that the trial court sitting as factfinder understands that pre-arrest and post-arrest silence cannot be used to determine guilt. Moreover, in the scope of the trial these comments were brief. The victim testified, the trial court found her credible, and the victim's allegations were sufficiently corroborated. Garza's reaction of ""I didn't do that"" to the victim's general accusation of ""you know what you did to me"" indicates he was aware of what the victim was accusing him of before entering the laundry room, which he could not have known otherwise. And Garza's unnatural reaction of ""dying laughing"" while listening to the victim relate her allegations further corroborates the victim's claims. Accordingly, we are convinced beyond a reasonable doubt that Garza would have been found guilty in the absence of this instance of prosecutorial misconduct. We overrule this assignment of error.",prosecutorial misconduct,Robert Hendrickson,Robert A. Hendrickson,"Robin N. Piper, Michael E. Powell","Robin N. Piper III,Michael E. Powell",,,,,,,"This is a bench trial case about a man accused of molesting a child who was over at his house for a sleepover with his kid. He alleged the state improperly questioned a police officer in the case. The appeals court found that to be the case, but said the misconduct did not prejudice the judge.",,2017-Ohio-1234.pdf (https://v5.airtableusercontent.com/v3/u/40/40/1745100000000/udIf2mN_jnrXOV1HPNf5zw/1h9cZPlocWT6374V7_tiNshdqYlMyjDBPRor3G5UV4MfKd3-aOTTqzukEKktsXa8uy_4cmkYZ2sr6LPc3CcEGtTyY-0OjKb66yejfYLCAq3D1HSUNbbmp4HjzIA6AGXQ8I92tKbYqo2gW9sDDV4KPDO9vYetHwxDhG3A9tI3rMs/4K1RTM79GHS7REo6DbWHvN7ouwwT97jLTsvYsvOTqj8), 2017-Ohio-1234,,Ohio District Court,Affirmed,,,,,,,,,Christopher F Neville,,Curtis Brodner,I couldn't find any of the details from the original trial. The specifics aren't mentioned in the appellate ruling and the Butler County clerk doesn't have a record.,CJI,,1500092B,,,CA2016-02-036,,,,,,,,,,,,"10, 12","42, 50","12, 13",51,,,
450-G.,checked,Fact-check complete,,1450,CA2016-11-098,,Twelfth District Court of Appeals,Ohio,Warren,Warren  ,2017-04-10,2017,2017,G.,R.,R. G.,,,,,,,,,,,2015,,,,,harmless error,,Stephen W. Powell,,"Robert Ringland,Robin N. Piper III",,,,,,,"The appellant here is seeking the return of her infant child, who was confiscated by the state after the infant tested positive for opiates. The appellant is also a minor, which means this case does not meet our standards.",,2017-Ohio-1333.pdf (https://v5.airtableusercontent.com/v3/u/40/40/1745100000000/JteZiG4uU1IuLGo2GXo3zQ/v8KoME4gy5N70A8NmsSf-aQMNuM8pIZXVe0LcX70WwWEcWAvnMUJzgSgpoOxGldrN3hrpOe7lSrOETWbZQz5bdR7tAd19ulM1JWosxBblaXUEULXxgy5_RfdncXR7lKOqXqPvUBUMR7pgSGYR1gWLLKUTRlqwV23Kz7U_mPkO3s/-QFo56_TjSuyQ6-U9S4g3NRkM-SrukgGJvK2ygoF8FM),2017-Ohio-1333,,,,,,checked,checked,Defendant is a juvenile,,,,Christopher F Neville,,Curtis Brodner,,,,,,,CA2016-11-098,,,,,,,,,,,,,,,,,,
451-Brinkley,checked,Fact-check complete,,1451,28238,Ninth District Court of Appeals,Ninth District Court of Appeals,Ohio,Summit,Summit  ,2017-04-05,2017,2017,Brinkley,Jurmaine K.,Jurmaine K. Brinkley,Black,2016,Robbery/theft,aggravated robbery,,,,,10 years in prison,,2016,Jury selection,"{¶25} In his second assignment of error, Mr. Brinkley contends that the trial court erred in overruling his objection to the State’s use of a peremptory challenge to exclude an AfricanAmerican juror. He argues the reasons provided for dismissing Juror Number 1 were a pretext for eliminating one of two African-American jurors. We disagree. ",No error,"{¶27} Here, the State exercised a peremptory challenge to excuse Juror No. 1, an African–American female, and one of two African-Americans seated among the first twelve jurors. The State indicated that it anticipated a Batson challenge from the defense, and it provided the following as racially-neutral reasons in support of its challenge: (1) Juror No. 1 had been sleeping through the majority of the Defendant’s voir dire, and (2) Juror No. 1 was on a criminal jury approximately two years ago and returned a “not guilty” verdict. Mr. Brinkley raised a Batson challenge, arguing that the given reasons were a pretext. The trial court determined that the State’s given reasons for challenging the prospective juror were race-neutral. Mr. Brinkley disputes that the juror was sleeping, and further argues that several other jurors had previously been involved in a trial. 

{¶30} There is no clear error in the trial court’s determination. The likelihood that the juror was asleep during voir dire, coupled with her sitting on a criminal jury that returned a “not guilty” verdict only two years earlier, gave rise to more than one racially neutral reason why the State might want to exercise a peremptory challenge. There was no discriminatory intent inherent in the prosecutor’s explanations. We further note that there is no pattern of excusing African-American jurors from the venire apparent in the record, and the State did not express similar concerns about any nonminority jurors who were permitted to serve, so there is no indication of disparate treatment. Accordingly, we conclude that the State satisfied its obligation 12 to provide a racially neutral explanation for the challenge under the second step of the Batson analysis. The trial court did not clearly err when it determined that the prosecution had credible racially neutral reasons for excluding the African–American juror. Mr. Brinkley’s second assignment of error is overruled.
",Batson v. Kentucky,Thomas A. Teodosio,Thomas A. Teodosio,"Donna J. Carr, Lynne S. Callahan","Donna J. Carr,Lynne S. Callahan",Sherri Bevan Walsh,Sherri Bevan Walsh,Justin Richard,Justin Richard,"Paul M. Grant, Jason D. Wallace",,This is a case about an armed robbery of a convenience store. The appellant argued a Batson violation for striking Black jurors during voire dire. The appeals court found the prosecutors provided suitable logic that went beyond race for striking the jurors.,,2017-Ohio-1269.pdf (https://v5.airtableusercontent.com/v3/u/40/40/1745100000000/-o7FNqcqItGEx2jOqSrI0A/sqEMLnxc83JW5YkgCxSUiKVU9i2_Ivkd7x8t1mfphL52Pw1tOWVisD7A_gjZSgkOUs55k_s1ACkYN_vEr4zZLEJDiBb7fOdICVjVvinoeV5k79t89ltMb5M437amdmAGlZgAUVeD7Ccaq--MxTjtYfa2DlJtkLNM35VmSHwiTmk/0yzTAFdkwVwaBcoZQcEtbIiIUKdiTaHpyjdRBNGXcbM),2017-Ohio-1269,,Ohio District Court,Affirmed,,,,,,,,,Christopher F Neville,,Curtis Brodner,check holding,CJI,,CR 15 12 3742,,,28238,,,,,,,,,,,Male,9,25,"10, 11, 12","27, 30",,,
452-Meyers,,Fact-check complete,,1452,7-16-15,,Third District Court of Appeals,Ohio,Henry,Henry  ,2017-04-10,2017,2017,Meyers,William,William Meyers,,,,,,,,,,,,,,,,harmless error,,William R. Zimmerman,,"Vernon L. Preston,John R. Willamowski",,,,,,,This is a lawsuit over breach of contract. Not a criminal case means it does not meet our standards.,,2017-Ohio-1320.pdf (https://v5.airtableusercontent.com/v3/u/40/40/1745100000000/VpDhg-7HHOoQZLypkVhT_A/0NT_NNo2yK6laIMBWhxP0ZoSOASE4brRLjkyYirZRs7yJgb8n2Hplu3XLQ5Bo6TiYaAw9t01ZD1Zz9Amxbpms4U-Ndhv2V8AJieBPNkqo1jd18g0L1VbacYDWFBc4mqsSOjzE3uS_R3NDHo_UURu_n4oqG__csENboOEuG1LHfA/eNho6a072rhr2D2k1tHej6V-QJ7yDBqzpWyWrEwfaMU),2017-Ohio-1320,,,,,,,checked,Case is not criminal,,,,Christopher F Neville,,Curtis Brodner,,,,,,,7-16-15,,,,,,,,,,,,,,,,,,
454-Fetherolf,checked,Fact-check complete,,1454,14-16-10,Third District Court of Appeals,Third District Court of Appeals,Ohio,Union,Union  ,2017-04-10,2017,2017,Fetherolf,Michael Jason,Michael Jason Fetherolf,White,2016,Sexual violence,rape,intimidation of a witness,,checked,Female,25 years to life in prison,,20152016,"Discovery,Examination of witnesses","1: Pg 14: {¶28} In his first assignment of error, Fetherolf argues that the trial court erred by allowing several of the State’s witnesses to provide testimony that he characterizes as vouching for the veracity of A.C.’s statements. 

2: Pg 18 {¶38} In Fetherolf’s second assignment of error, he argues that the trial court erred by permitting “other acts” evidence that he contends had no bearing on any fact of consequence, and that the trial court erred by failing to exclude details of Fetherolf’s prior conviction and sentence when he did not testify. 

3: Pg 26 {¶56} In Fetherolf’s third assignment of error, he argues that the trial court erred by denying his motion for a new trial. Specifically, Fetherolf contends that the State committed discovery violations by failing to disclose Pamela Hawkins’s 2015 misdemeanor conviction for falsification. 

4: Pg 30 {¶67} In his fourth assignment of error, Fetherolf argues that the prosecutor committed misconduct that deprived him of a fair trial. Specifically, he contends that the prosecutor committed misconduct for eliciting the testimony he claims was erroneous in the first and second assignments of error and that the prosecutor committed misconduct by failing to disclose Hawkins’s prior conviction for falsification referenced in the third assignment of error. ",Did not reach error/conduct did not result in prejudice,"1: Pg 18: {¶37} In this case the consistent statements of A.C. were corroborated by the DNA evidence. The jury was also able to see A.C.’s deposition and at least draw inferences from A.C.’s demeanor as to whether she may have been the victim of sexual abuse or not. We simply cannot find that even if we read the SANE’s isolated statement in the worst possible light that it was so egregious that it rose to the level of plain error or that without the statement the outcome of the trial would have been different. Therefore, we do not find Fetherolf’s arguments well-taken, and his first assignment of error is overruled. 

2: Pg 25, 26 {¶54} Even if we assumed that the testimony related to Fetherolf’s prior conviction was not admissible, it can be argued that it was a valid trial strategy by the defense to allow in testimony that Fetherolf was on probation for a non-violent offense. Fetherolf essentially left the Marysville area right after the alleged incident with A.C. and without another valid reason to leave—such as running from child support—it could have appeared to the jury that Fetherolf was fleeing from a crime against A.C. that he knew he had committed. Thus defense counsel may have wanted this testimony to be introduced for a valid purpose. 

{¶55} Nevertheless, even if we presumed that Fetherolf did object and that the testimony was not admissible, we cannot find that the mentions of Fetherolf’s probation and his felony child support so tainted the proceedings that his convictions must be reversed, particularly given that it had some arguable benefit to the defense. Moreover, the State’s case was relatively strong insofar as statements of A.C. were actually corroborated in this case by the DNA evidence. Therefore, Fetherolf’s argument is not well-taken, and his assignment of error is overruled.

3: Pg 29, 30 {¶65} While the better practice may be for the State to continuously update the criminal records of its witnesses, we cannot find in this case the failure to do so was reversible error. This case was pending for years before it was brought to trial. The State indicated that it disclosed the relevant prior convictions that it was aware of before Hawkins was ever convicted of misdemeanor falsification in a nearby county. Here there is no indication that the State specifically tried to hide anything from the defense, particularly since the State actually elicited testimony from Hawkins that she went to jail and had other convictions. 

{¶66} Finally, given that Hawkins’s credibility was already called into question at trial by admitting that she had prior convictions, admitting that she had gone to jail, and admitting that she was drinking to the point of addiction during the time she spent with Fetherolf, we cannot find that this one additional conviction would have cast such additional doubt on her credibility that it impacted Fetherolf’s convictions. Therefore, for all of these reasons, Fetherolf’s third assignment of error is overruled.  

4: Pg 31 {¶69} Individually, we have found that none of the assigned errors by Fetherolf were reversible. In this assignment of error, he argues essentially that the prosecutor’s cumulative actions render his convictions reversible. Given the evidence in this case, complete with DNA, and as noted earlier the jury’s ability to at least observe and evaluate the victim’s demeanor, even if she did not testify regarding the acts specifically, we cannot find that any errors we have found in this case cumulatively resulted in reversible error based on prosecutorial misconduct. This is particularly true given that defense counsel did not object to some of the testimony, possibly on the basis of trial strategy, and given that some of the testimony elicited was not objectionable at all. Thus we cannot find any prosecutorial misconduct in this case that rises to the level of prejudicial error, and Fetherolf’s fourth assignment of error is overruled. ",prosecutorial misconduct,Stephen R. Shaw,Stephen R. Shaw,"John R. Willamowski, William R. Zimmerman","John R. Willamowski,William R. Zimmerman",David W. Phillips,David William Phillips III,Terry L. Hord,Terry L. Hord,Perry R. Parsons,,"This is an incest rape case in which a father was convicted of raping his daughter, who was younger than ten years old at the time. The defendant argues prosecution elicited improper testimony and failed to turn over discovery material in a timely manner. The appeals court finds no error in one of the testimony assignments of error and no error in the discovery assignment of error.",,2017-Ohio-1316.pdf (https://v5.airtableusercontent.com/v3/u/40/40/1745100000000/jrRlcdeqj3Kbtee24gsjBw/TlwLSBkJvBGyrEe58O_7eqouAXIkeA7GPDvIjQUSD8X7gwj7oPuvG9XWFAF-gDZGyqoX1sGL4Ex34Nt_LG_U-jv9v20KJc1hI26pmrt15jZKTYQQZRIhgaKeoG4gnhU4UuUYO9scKzzFGl1LVJvL1-OENeDFZJX94IdFfxfX7Ok/IietjJL9t5eSEQYEOZwzxEeX-cMeomMpUuvfJ0xjv_4),2017-Ohio-1316,,Ohio District Court,,,,,,,,,,Christopher F Neville,,Curtis Brodner,court holding,CJI,,13-CR-0207,,,14-16-10,,,,,,,,,,,Male,"14, 18, 26, 30","28, 38, 56, 67","18, 25, 26, 29, 30, 31","37, 54, 55, 65, 66, 69",,,
460-Mayse,checked,Fact-check complete,,1460, 9-16-50,Third District Court of Appeals,Third District Court of Appeals,Ohio,Marion,Marion,2017-04-24,2017,2017,Mayse,Richard Allen,Richard Allen Mayse,White,2016,Assault,felonious assault,,,,Female,six years in prison,,2016,Discovery,"Pg 10 {¶14} In the second assignment of error, Mayse claims that the trial court erred in denying his motion for a mistrial after the State failed to disclose the victim’s prior criminal record before she testified.",Harmless error,"{¶16} The Ohio Supreme Court has previously held that “prosecutorial violations of Crim.R. 16 result in reversible error only when there is a showing that (1) the prosecution's failure to disclose was willful, (2) disclosure of the information prior to trial would have aided the accused's defense, and (3) the accused suffered prejudice.” State v. Jackson, 107 Ohio St.3d 53, 2005-Ohio-5981, 836 N.E.2d 1173, ¶ 131. In this case, there is no dispute that the State failed to disclose the criminal record of a witness as required by Criminal Rule 16. Tr. 289-90. Upon learning of the failure to disclose, Mayse requested that the trial court grant a mistrial. Tr. 289. The State informed the court that there was an error and that attempts had been made to recall the witness, but she had not responded. Tr. 290. The State then proposed a stipulation be read to the jury informing them that the witness had been convicted of a theft offense in 2016 and possession of cocaine in 2010. Tr. 290. The stipulation would also inform the jury that they could consider these crimes when weighing the credibility of the witness. Tr. 291. The trial court overruled the motion for a mistrial and agreed to inform the jury of the prior convictions. Tr. 293. The trial court then advised the jury as follows. The second matter we need to advise you is that the Court wishes to instruct you that [the victim], who testified here yesterday, has been convicted of the offense of possession of cocaine in the year and further was also convicted of the offense of theft in February of 2016. This information that we’re providing you may be used for the purpose of determining the credibility of [the victim]. This information may not be used for any other purposes. Tr. 296. A review of the record contains no evidence that the failure to disclose was willful. 
{¶17} Second, the record does not show how this information would have aided the defense as it was not exculpatory. Mayse claims that this would possibly suggest that the victim was biased, thus implicating the Confrontation Clause as set forth in the Sixth Amendment to the United States Constitution. Mayse claims that this is error because the jurors did not get to see the victim’s face when she was questioned about her criminal record. Bias is defined as a “mental inclination or tendency; prejudice; predilection.” Black’s Law Dictionary (10th Ed. 2014). However, the victim’s criminal convictions at issue were not connected with the defendant and she was not given any consideration for her testimony. There is nothing in the record that would show that those convictions would show a prejudice against the defendant. Thus, they do not show a bias. Additionally, the criminal history of the victim was only admissible for the purpose of attacking her credibility. Evid.R. 609. 
{¶18} Finally, even if it would have aided the defense, the defense suffered no prejudice as the trial court fully informed the jury about the victim’s prior convictions. The statement made by the judge may have had more of an impact than merely questioning the witness about the offenses because it drew more attention to the crimes and included a contemporaneous instruction that it could be considered for the purpose of determining the credibility of the victim. Since the jury was fully aware of the charges, there was no prejudice suffered. The failure to disclose is thus not reversible error and the trial court did not abuse its discretion in denying the motion for a mistrial. The second assignment of error is overruled.",harmless error,John R. Willamowski,John R. Willamowski,"William R. Zimmerman, Stephen R. Shaw","William R. Zimmerman,Stephen R. Shaw",,Kevin P. Collins,,,,,"This is a case in which a man assaulted his neighbor over an argument about moving his car. He claimed a discovery error in because the prosecution failed to notify the defense of a witness' criminal history. This was noted during trial, and the court notified the jury, rectifying the error in the eyes of the trial court.  The appeals court affirms this decision.",,2017-Ohio-1483.pdf (https://v5.airtableusercontent.com/v3/u/40/40/1745100000000/AtwNTo7Jf9xQmo_pB2R5Jw/Fw1wUb4xcnC8BhMZwL7Kl4M39YvxtSJw7N7FxjdlZA1MS19YlLZM9kekdyl2KKrSlnvX-0Y8liDZvd2WmEBtvdybHNJWBMhepvgE0itSa-ZrSH7YkkPPcbOgS8tEzCnBDTQMvvLG38bPZlVk6UvQ3YEiRj5LP_IOH96mWrIwkXU/17IguNruAISTEzVBWFoBljUUuKo3vBytGMS4K0Y--ow),2017-Ohio-1483,,,,,,checked,,,,,,Madhumitha Baby Kumar,,Curtis Brodner,"Do you agree with the court holding being no error? It seems to me that the prosecutors acknowledged they should notified defense of the witness' criminal history. But the trial court found the error to be harmless by rectifying it by notifying the jury. By agreeing with the trial court, it seems like the appeals court acknowledges there was error and affirms it was harmless.",CJI,,16-CR-165 ,,,9-16-50,,,,,,,,,,,Male,10,14,"11, 12, 13","16, 17, 18",,,
