645-Smith,checked,,,1645,C-160836,First District Court of Appeals,First District Court of Appeals,Ohio,Hamilton,Hamilton  ,2017-11-15,2017,2017,Smith,Maurice,Maurice Smith,,2016,Robbery/theft,Trafficking of Cocaine,"Burglary, possession of cocaine, possession of marijuana, tampering with evidence, community-control violation. ",,,Male,9 years consecutively to 7 years consecutively to 1 year,,2016,"Summation,Examination of witnesses","{¶48} In his seventh assignment of error, Smith contends the prosecutor committed misconduct by asking the officers about the quantity of cocaine and calling Brandon as a rebuttal witness. As previously discussed, the officers’ testimony and the rebuttal testimony were properly admitted. Smith further claims the prosecutor’s closing argument contained misstatements of fact and law in describing the burglary element of “likely to be present” and the trafficking element of “intended for sale or resale by the offender or another person,” and the prosecutor improperly vouched for Brandon. Smith concedes he failed to object to the remarks, so our review is limited to plain error.",No error,"{¶51} Even if the prosecutor’s statements were improper, we find that the outcome of the proceeding would not have been different absent such statements. In light of the evidence presented at trial, Smith would have been convicted in the absence of the prosecutor's remarks.
{¶52} Having found that the prosecutor did not make any improper remarks, we overrule Smith’s seventh assignment of error.
",,J. Zayas,Marilyn Zayas,,"Beth A. Myers,Charles M. Miller",,,,,,,"prosecutor commitment misconduct by asking officer about quantity of cocaine and calling one of the witnesses as a rebuttal witness. Also that in closing statement there was misstatements of fact and law in describing the burglary and trafficking criminal elements and improperly vouching for rebuttal witness. However, court says review is only for plain error since Smith did not object to the remarks. There was no plain error because Smith would still have been convicted even if the remarks were improper. Court says that remarks were not improper based om the record. So no error. But court remands because of a sentencing error by the trial court. ",,2017-Ohio-8558.pdf (https://v5.airtableusercontent.com/v3/u/40/40/1745100000000/U-CLWOTJGlD9kdmDRsl-sg/4nxXHbWiuvLPGLQYCoaPuDxtHoxxlWjju-C2pXt5Ur-voqykzz1oLLK_ED40AHeenuQbj1Sy2ja2Oe6ds3Xnx5r0yh9aT0Mlb2aS6k-y0bIyenVgZ6DuzMPmFKCG_OFB82zY5iHTxZu9NZXoV6imyqoXLbswMS6l4pPKTLwxbd0/MKq2lD_bM34xJe71bs1xf9gamFLR-Wf1Lm1Pc1G8vUk),2017-Ohio-8558,,,,Resentencing,,checked,,,,,,,,Madhumitha Baby Kumar,Holding graf and numbers,,,B-1506673 ,,,C-160836,,,,,,,,,,,,14,48,15,51,,,
654-Heard,,,,1654,CA2016-11-095,,Twelfth District Court of Appeals,Ohio,Warren,Warren  ,2017-12-04,2017,2017,Heard,Robert,Robert Heard,,2016,Assault,,,checked,,Female,,,2016,,,Did not reach anything/ reverses on other grounds,,harmless error,,,,"Robert A. Hendrickson,Michael E. Powell",,,,,,,n/a ,,2017-Ohio-8796.pdf (https://v5.airtableusercontent.com/v3/u/40/40/1745100000000/5ATT7bV41NbkFf3AoOLRQw/apXcRXPJuJxELXbP_6fCCuSKIXzg75HzPQiPorSpZImoVc_s8M8Uj_9M4Jb5ZEQi8LPuh7rNVvjRMUQs2TM1JXmK8UWGBxKq4Xk0b3paHCq5eKhHS62RsdPuCmoZs1dzCak2HK_t_O3P4iAPl6E0jclncshk9YznR8qyH7_gzhA/jUvFfZkzBkZpk4TXsMaowz8Bfe6_kcKAIXeqHBgQ27o),2017-Ohio-8796,,,,New trial,,checked,checked,"""Allegation of error is against the court, not the prosecutor/state"",No allegation of prosecutor misconduct",,,,Christopher F Neville,,Madhumitha Baby Kumar,,,,2016 CRB 00244 ,,,CA2016-11-095,,,,,,,,,,,,,,,,,,
655-Dyer,,,,1655,27384,,Second District Court of Appeals,Ohio,Montgomery,Montgomery  ,2017-12-01,2017,2017,Dyer,Lance,Lance Dyer,,2016,Other,,,checked,,Female,,,2016,,,,,Crim.R. 16,,Mary E. Donovan,,Jeffrey M. Welbaum,,,,,,,n/a,,2017-Ohio-8758.pdf (https://v5.airtableusercontent.com/v3/u/40/40/1745100000000/xHj1mM-D4t3LcPbDLJT0zA/gOeYkCUCQgcspMaSD4Jq60BPCTRaxGNNjtPWON7unhem7lI4LTfvbL2FM1D5ybCGUc7kXcaNf1SX8z-_YUKfL8Xtlnti845R74vfPlDRDvZOrIPcIxpFMKbDpZLml_0vkVVy1ny_KiOjDda3kfqO84JWFWj_VCM4kbbCWgt2Vn4/hVrQs-ix0AUDIBpVUFFrCdIdPgY5rrbOuF23XonnFX8),2017-Ohio-8758,,,,,,checked,checked,"""Allegation of error is against the court, not the prosecutor/state"",No allegation of prosecutor misconduct",,,,Christopher F Neville,,Madhumitha Baby Kumar,,,,16-CRB-4915 ,,,27384,,,,,,,,,,,,,,,,,,
656-Umstead,,,,1656,16 CA 004,,Fifth District Court of Appeals,Ohio,Holmes,Holmes  ,2017-11-30,2017,2017,Umstead,Matthew B.,Matthew B. Umstead,,2016,Drugs,,,,,,,,2016,,,,,Crim.R. 16,,John W. Wise,,"Patricia A. Delaney,William B. Hoffman",,,,,,,n/a,,2017-Ohio-8756.pdf (https://v5.airtableusercontent.com/v3/u/40/40/1745100000000/z3l19h_g8LnBOsJ5D4gg2g/bG2UBrpVFOGBOPbz6Fd3J5p0hiiLr-_HE3wXWCW9Xhhg6-xX18TG8J2uLAR9i1X75UFZ2Grr5LyzpGHjN18XOmdTaaWilOUdUX662e5IvCi_4O95f-iWMtlbrh840LSCpHxnE1UeFued1d0NsD5ULTkFVk7f-uGws6CrBEI9WZA/qwAno3YH4_66D4b4nmvP_qf1meaOdM7ZHaf1V774IBI),2017-Ohio-8756,,,,,,checked,checked,"""Allegation is against defense attorney, not state"",No allegation of prosecutor misconduct",,,,Christopher F Neville,,Madhumitha Baby Kumar,,,,"15CR106,16CR006",,,16 CA 004,,,,,,,,,,,,,,,,,,
657-Mowls,,,,1657,2017CA00019,,Fifth District Court of Appeals,Ohio,Stark,Stark  ,2017-11-20,2017,2017,Mowls,Justin A.,Justin A. Mowls,,2017,Assault,,,,,Male,,,2017,,,,,harmless error,,Patricia A. Delaney,,"William B. Hoffman,""Earle E. Wise, Jr.""",,,,,,,n/a,,2017-Ohio-8712.pdf (https://v5.airtableusercontent.com/v3/u/40/40/1745100000000/E0fXPGNsUepgJcvCJ4rH7Q/_3epragRWDPmzo945KMf4XcIzvOJApe89KJsh3cWemS7dVcS3Cr0bKWKWqpfvMSUSLrfod2_IomPxIXRsg9WNdbrPqagAiKUAj7Uo5CWumPNQ-U2nyz3g-eC0XFFGUJrydlWKZV7zMYqQJVxq5ZhBu0yzCUE1d0geqaojgEgiV8/YhHx31yqRWdOfKs0d2f3slpgE3DXwZ8zseQdG3NqXNc),2017-Ohio-8712,,,,,,checked,checked,"""Allegation is against defense attorney, not state"",""Allegation of error is against the court, not the prosecutor/state"",No allegation of prosecutor misconduct",,,,Christopher F Neville,,Madhumitha Baby Kumar,,,,2016CR1211,,,2017CA00019,,,,,,,,,,,,,,,,,,
658-Gragg,,,,1658,17CA2,,Fourth District Court of Appeals,Ohio,Highland,Highland  ,2017-11-17,2017,2017,Gragg,James F.,James F. Gragg,,2017,Sexual violence,,,,,,,,2017,,,,,Crim.R. 16,,,,,,,,,,,n/a,,2017-Ohio-8703.pdf (https://v5.airtableusercontent.com/v3/u/40/40/1745100000000/CqNFUpPjXGGjzktnyF7gsw/foSIXW5rtRjq7JPV3ulPhA8h0nxqkSujYA0NzY_5k5JTFCp0qMaMkwuiB0hzqSdQiWOOI1Ljjp9MRDABrCHdSBV3cULAeNdRYuYGqmWxOWJWZQr-Gnl8CPlPbYldylutYV5Vvq1sqF9CMZaiT684FeEQG1qLmIQf2yPPiKIYcz8/zFWCW8DbiwA4hb4GlexBJ0qojOuFkFIh7eCDzgOLG8c),2017-Ohio-8703,,,,,,checked,checked,"No allegation of prosecutor misconduct,""Allegation of error is against the court, not the prosecutor/state""",,,,Christopher F Neville,,Madhumitha Baby Kumar,,,,,,,17CA2,,,,,,,,,,,,,,,,,,
660-Tabor,,,,1660,16CA9,,Fourth District Court of Appeals,Ohio,Jackson,Jackson  ,2017-11-16,2017,2017,Tabor,Jarron,Jarron Tabor,,2015,Drugs,,,,,,,,2015,,,,,harmless error,,,,,,,,,,,structural error - is that procedural? ,,2017-Ohio-8656.pdf (https://v5.airtableusercontent.com/v3/u/40/40/1745100000000/YA3s-DcmyLlQvQO8vCM_wA/NnMgNsgkJ9BgXrMUMT5_wppMJZeqCGScd1DdYAKWgxsoCJY4lFBm6v8ZyvAff01WGZ0k4v_zF5jay0AewnaHhDZ5vr6lBHuADB072NYXKjuid8oJQQqPjL8qJ678mnlwrC2NCfkWvlVHWW9PeN5e9oJj0e02IHf9O8HhirYro_A/OKh5WwlFzd1SgimFXpJcexKWn2jfa_NszMGvzmqFNT8),2017-Ohio-8656,,,,,,checked,checked,"""Allegation of error is against the court, not the prosecutor/state"",""Allegation is against defense attorney, not state"",No allegation of prosecutor misconduct",,,,,,Madhumitha Baby Kumar,,,,,,,16CA9,,,,,,,,,,,,,,,,,,
661-Dillingham,,,,1661,CA2017-08-111,,Twelfth District Court of Appeals,Ohio,Butler,Butler  ,2017-11-20,2017,2017,Dillingham,Charles,Charles Dillingham,,2011,Assault,,,,,,,,,,,,,prosecutorial misconduct,,Stephen W. Powell,,"Michael E. Powell,Robert A. Hendrickson",,,,,,,"the allegation of prosecutorial misconduct is in procedural history and trial court denied the motion for new trial because of timing of filing. This appeal does not directly address the prosecutorial misconduct allegation because it is not filed here, but rather just about the trial court's denial of the previous motion. ",,2017-Ohio-8637.pdf (https://v5.airtableusercontent.com/v3/u/40/40/1745100000000/ry1BkUJca9mG2jguCbd1jA/LX3TbkAMLaJ8XleIdbwbu7msXGgED0UG9WIr0SPqnF15NrIDvM7iAGY0ygnd_2oJAMK7IQwuIhifvYh4v0_HrQyh8gxRoBJp1_i9qNVC-KWjU_IwEYPxqOX1WyZmOrZUh7RxQqk3T9l10GzhEXEadFmW6rdZPJbNdxC081tsW1I/5Gf4Hahqs12jqDfIQ4c_91X2LgopIXlDRYzvVCk3aXU),2017-Ohio-8637,,,,,,checked,checked,"Allegation is in procedural history,Other",,,,Christopher F Neville,,Madhumitha Baby Kumar,,,,,,,CA2017-08-111,,,,,,,,,,,,,,,,,,
663-Siferd,,,,1663,5-17-04,,Third District Court of Appeals,Ohio,Hancock,Hancock  ,2017-11-20,2017,2017,Siferd,Ronald L.,Ronald L. Siferd,,,,,,,,,,,,,,,,harmless error,,,,J. Shaw,,,,,,,n/a,,2017-Ohio-8624.pdf (https://v5.airtableusercontent.com/v3/u/40/40/1745100000000/1FTszMKw0suMLSWof_3KUA/FOqqte--f4w44VJFcI5JE4dd8uYZj0F-NXUk6K5S_-WUGdpXPb31-Ovc9cFO0N-7O75HsbokAMk8s-nrR0h3YF-u4fTYak5G2_5r7ljOdin1LCfdZyTqrpWy5wrOLrRK_AeVqrd5PaoSOr2mRN7lu84PcqM6fqW4T4SGzQx_SrU/wKAU7U5ebUWPTXjUWxOch1L0YnkUPG-c8HocYQyvcPo),2017-Ohio-8624,,,,,,,checked,Case is not criminal,,,,,,Madhumitha Baby Kumar,,,,,,,5-17-04,,,,,,,,,,,,,,,,,,
664-Makin,checked,,,1664,CR-15-594103-A,Eighth District Court of Appeals,,Ohio,Cuyahoga,,2017-11-13,2017,,Makin,Hakeen,Hakeen Makin,,,,Drug Related,,,,,,,,"Discovery,Other or unknown","{¶10} In his second and third proposed assignments of error, Makin argues that the prosecutor presented “fabricated evidence,” which his trial counsel should have challenged and that his appellate counsel should have raised assignments of error relating to prosecutorial misconduct and ineffective assistance of counsel. Makin argues that the prosecutor lied about the confidential informant being fitted with “two separate devices” as opposed to just one recording device. Makin further contends that the prosecutor coerced the CI to commit perjury as to the recording devices and that the prosecutor introduced a “fabricated” audio-recording. But our review of the record does not support Makin’s argument.",No error,"{¶11} The record reflects that the state presented several exhibits evidencing the meetings and controlled buys, which included both audio and video recordings, spanning from March through July 2014. The authenticity or admissibility of these exhibits, including the recording that Makin now challenges, were not questioned at trial. The record, however, does not reveal any grounds to challenge the recording. Indeed, the CI directly testified as to the recording that Makin challenges. We find no basis to support Makin’s claim that the prosecutor “fabricated” evidence. Moreover, Makin’s argument fails to demonstrate any prejudice that would support an ineffective assistance of appellate counsel. Accordingly, we find appellate counsel was not ineffective in refusing to raise such a baseless argument.",,Anita Laster Mays,,"Kathleen Ann Keough, Patricia Ann Blackmon",,Michael C. O'Malley,,Daniel T. Van,,,,"allegation claims that the state made up fake evidence in both audio and video recordings, but were not questioned at trial. Not much information produced here about the crimes of the defendant himself. Court says that because there is direct testimony related to the tapes too, it is not fabricated. Also an IAC claim here. ",,2017-Ohio-8569.pdf (https://v5.airtableusercontent.com/v3/u/40/40/1745100000000/SB8jW2MwVsdM0_MZCRKRPg/r1IhQWwn3eC6KXurNt-1dFItiiHhxUwQaQbzYe-XhCAh83gAml7cG043tDlbVMHvXgUznOWE3M3MqSPPefyVsXOCFMNrf3Fb98MmCBlOD6NyOEUV_wXh0FRIDqHjgS8_t6TOZi6jLqdmtuIhu9slOFw9Vgm53Rrg3d_f7iTjFws/ccFEFnyHIwumWNcpgkAQvnp7Prw3QS37mIjXUyN1inA),2017-Ohio-8569,,,,,,,,,,,,,,Madhumitha Baby Kumar,"holding; Also, ""fabricated evidence"" in allegation goes under discovery i think, but I also included ""other"" category just in case. ",,,,,,CR-15-594103-A,,,,,,,,,,,,5,10,6,11,,,
665-Carter,checked,"Needs reporting (tabs),Fact-check complete",,1665,CR-16-603056-A,Eighth District Court of Appeals ,Eighth District Court of Appeals,Ohio,Cuyahoga,Cuyahoga  ,2017-12-07,2017,2017,Carter,Demetrius H.,Demetrius H. Carter,,,Sexual violence,Rape,"Kidnapping, Gross Sexual Imposition",,checked,Female,8 years,,,Other or unknown,"IV. Appellant was denied due process and a fair and impartial trial as guaranteed by the Fifth, Sixth, and Fourteenth Amendments of the United States Constitution and Article 1, Section 16 of the Ohio Constitution based on prosecutorial misconduct;",Did not reach anything/ reverses on other grounds,"{¶23} The remaining assignments of error are moot pursuant to App.R. 12(A), and therefore a determination on those issues are not required.",prosecutor misconduct,Anita Laster Mays,Anita Laster Mays,"Mary Eileen Kilbane, Eileen T. Gallagher","Mary Eileen Kilbane,Eileen A. Gallagher",,,"Jeffrey Schnatter, Glen Ramdhan",,,,victim is juvenile and her father is accused of raping her and making uncomfortable sexual moves multiple times. The allegation is that the testimony of the social worker and the mental health doctor of the victim was prejudicial and  impermissible because of calling the victim’s accusations “credible and consistent”. Never addresses prosecutorial misconduct apart from the one sentence included. ,,2017-Ohio-8864.pdf (https://v5.airtableusercontent.com/v3/u/40/40/1745100000000/hR5AkzwQ9r0I-CWHhSd0jA/_Ypvn54mneWELNRKn9rTv3L7kuiVUjqz_l5ZpZ3-lkF0emtrf0aJsjgCzgalKTHi0NI3_4u3bUkS9IQg8hi7gB0wyju9WJJshjL-MSpPa8PCdZ2wR7vpPXS7ijo_f3rwRnKchzDreOc5SXcf6TbmCkM4YmafSChLdE0NOAmLf2U/3vxH6Jp6E0Ojbl516PDzk7kDc7sO9ppyN94hND9Sf6o),2017-Ohio-8864,,,,New trial,,,,,,,,Christopher F Neville,,Madhumitha Baby Kumar,allegation graf - should it include all other irrelevant errors since they're in the same paragraph? Holding; the court reverses on other grounds and never addresses the main PM allegation. ,,,CR-16-603056-A,,,CR-16-603056-A,,,,,,,,,,,,6,9,13,23,,,
666-Boaston,checked,,,1666,L-15-1274,Sixth District Court of Appeals,Sixth District Court of Appeals,Ohio,Lucas,Lucas  ,2017-12-01,2017,2017,Boaston,Ronald,Ronald Boaston,,2014,Murder,Murder,,checked,,Female,Life with parole after 15 years,,2014,Summation,"{¶ 81} In his fifth assignment of error, appellant asserts that “the trial court erred by allowing prosecutorial misconduct when the prosecutor stated facts not in evidence during closing argument.” Boaston asserts that on five separate occasions during closing argument, the prosecutor misrepresented the evidence or made improper, unfairly prejudicial statements. Appellant did not object to the statements at trial.",No error,"{¶ 83} Upon review of the closing argument as a whole, we find that the prosecutor’s remarks did not rise to the level of plain error. We cannot say that absent the prosecutor’s remarks, the jury would not have convicted Boaston. Accordingly, appellant’s fifth assignment of error is not well-taken.",prosecutorial misconduct,Mark L. Pietrykowski,James D. Jensen,"James D. Jensen, Christine E. Mayle","Mark L. Pietrykowski,James D. Jensen,Christine E. Mayle",Julia R. Bates,,Evy M. Jarrett,,Stephen P. Hanudel,,the case is about a man murdering his ex wife. The allegation for the prosecutorial misconduct is about the prosecutor's closing argument where he claims that prosecutor made false statements but defendant did not object during trial. So court takes it at plain error. Note that there is no particular reasoning provided as to why it does not rise to plain error – court just says no plain error. ,,2017-Ohio-8770.pdf (https://v5.airtableusercontent.com/v3/u/40/40/1745100000000/X7nmq9t_Dw6IYFkRKrFiSA/8AsJwVxt6lo5AWwd6tuQthXvaO17YPzheqh8KKMWGLmXXSs4c0aOhMi0uHUoWWmT5RP-M_vjkyBj3JfIHnaT5ECfbxOmi61KMK-IyI459vmzyG6aboV6k9yOR44oFJFQjpaLL-fszQSmUwDMCskKJoTrnR4EWZw7UzYXn75Ue7c/n5P8Pc4QeqXOROkjpHXGppnFykyFqxD8b415dLLcaFg),2017-Ohio-8770,,,,,,,,,,,,Christopher F Neville,,Madhumitha Baby Kumar,Holding; is it no error or is it did not reach error. ,,,CR0201401647 ,,,L-15-1274,,,,,,,,,,,,28,81,28,83,,,
543-Riley,checked,,"defendant race,defendant gender",1543,16CA29,FOURTH APPELLATE DISTRICT,,Ohio,WASHINGTON,,2017-06-27,2017,,Riley,Dennis,Dennis Riley,,2016,,Sexual Battery,,,,,"{¶ 6} On July 1, 2016, the court held a sentencing hearing.4  At the sentencing hearing, the court imposed the 18-month (1.5 years) sentence recommended in the plea agreement.",,2016,Brady violation,"Appellant asserted that the state failed to disclose evidence in violation of Brady v. Maryland, 373 U.S. 83, 83 S.Ct. 1194, 10 L.Ed.2d 215 (1963), and, thus, he could not have knowingly and intelligently entered his guilty plea. Appellant claimed that the state failed to disclose the existence of text messages between Officer Ellenwood and the victim. Appellant argued that the text messages contain evidence of an inappropriate, intimate relationship between Officer Ellenwood and the victim. Appellant asserted that the officer’s conduct undermines his credibility as a witness, as well as the credibility of the information that he obtained from the victim. Appellant contended that the officer likely used the relationship “to dissuade [the victim] from recanting her accusations.” Appellant thus argued that the evidence concerning Officer Ellenwood’s conduct would have allowed him to impeach the officer at trial and that the evidence constituted material evidence under Brady. Appellant argued that the state’s failure to disclose the evidence concerning Officer Ellenwood entitled him to withdraw his guilty plea and have his sentence vacated. ",No error,"{¶ 28} The court determined that “impeachment information is special * * * not in respect to whether a plea is voluntary (‘knowing,’ ‘intelligent,’ and ‘sufficient[ly] aware’),” but instead, “in relation to the fairness of a trial.” Id. (emphasis sic). The court agreed that “the more information the defendant has, the more aware he is of the likely consequences of a plea, waiver, or decision, and the wiser that decision will be.” Id. The court found, however, that “the Constitution does not require the prosecutor to share all useful information with the defendant.”",,Peter B. Abele,,,,Kevin A. Rings,,Jeremy B. Wolfe,,William L. Burton,,Trial Court Case No. was not mentioned in the decision. I looked at the docket for it. Please review through the PDF attached.,,"2017-Ohio-5819.pdf (https://v5.airtableusercontent.com/v3/u/40/40/1745100000000/GW2C9eV7BDbbk3jC8avlTA/TDmcZf9Ayy9qW9Ee3TPMu4JuHo1t2_MofkoAmmwXCB4kvlEXc4eWHd28yONluqDGA7ODs171E8TQKvue8_4uCgnnlKBtLPUrGST9na7a7iJNBBqIRsgUwILS8sxU0VjoW4xNYLyuPyhNs9vp88saOwiFcBTOaK0EEDoycJvvWRI/RbwgrjTSuhKpPPEqovoRKWsVtcH9G1YzKONQwffksNw),Ohio Case Docket.pdf (https://v5.airtableusercontent.com/v3/u/40/40/1745100000000/qbJWX5eIBLAIoB-NyftCmw/ff3BDUPV781rS2sKx5NzgNIsS4jLKeEWqFBRxhy2v2gEv3DAZyOGni_xPfmTluJpZ6_PP8Sr1tjPwhQx1KgYJs4UvW1LWwJ2USMDw3nNGQOEbvsOZadtiiVThdIVujjIZFixxKWMMZCW8o8JKG0r84t31vzbw_li-7bEy2Yvzk4/b2L8b6HkeA_Y_gUekezquYzf_byXdPgaExIyHJlutes)",2017-Ohio-5819,,,,,,,,,,,,,,Navya Asopa,The decision does not explicitly mention 'prosecutorial misconduct. The assignment of error says the trial court erred. But I think the case meets the standards due to Brady violation. Please review this.,CJI Stabile,,2017-1481,,,16CA29,,,,,,,,,,,,4,8,16,28,,,
593-Raider,,,,1593,16CA010926,Ninth District Court of Appeals,Ninth District Court of Appeals,Ohio,Lorain,Lorain  ,2017-09-25,2017,2017,Raider,Ryan E.,Ryan E. Raider,,,Murder,Murder,Felonious assault with firearms specifications,,,,15 years to life for murder and 3 years for the firearms specifications,,,Examination of witnesses,"""Raider argues that the prosecutor’s question of defense firearms expert Thomason was improper and prejudicial, should have been stricken, and that a curative instruction was required."" ¶42",Did not reach error/conduct did not result in prejudice,"""Accordingly, in light of the foregoing, we cannot say that Raider has demonstrated that he was prejudiced by any improper conduct by the prosecution. See Brooks, 2017-Ohio-5620, at ¶ 13. Considering the improper question in the context of the entire trial, 19 including the other related questions which were unchallenged, Raider has not demonstrated that, in the absence of that one question, he would not have been convicted. See Pleban, 2011-Ohio3254, at ¶ 39; Miller, 2015-Ohio-279, at ¶ 22."" ¶ 46",,,Donna J. Carr,,"Julie A. Schafer,Lynne S. Callahan",,,,,,,"There is a dissent from J. Callahan stating that they would have found this question to be prejudicial. 
Defendant was convicted of murdering Brandon Smith. In the course of the trial the prosecutor asked inflammatory questions of an expert witness. Prosecution had previously objected to defense’s questioning which led to a sidebar and casual agreement about the types of questions they would be asking. This likely played a role in why the defense permitted a few inflammatory questions before objecting to an especially inflammatory question about how difficult it is for the type of gun to go off accidentally. Prosecutor made sure to finish their question even after the objection was stated, ensuring the jury heard it. The court’s holding is related to this in that the court says that the single question was not prejudicial in light of all of the of the other unaddressed/unchallenged questions. ",,2017-Ohio-7788.pdf (https://v5.airtableusercontent.com/v3/u/40/40/1745100000000/3qxolsz2K4meI7yrlpy5jg/qm7B05yYTj10YlxDpUJqwHGeV-4sQp_JaaFXkxrVVwur01uZTpM6Y-t68fAPGTpjV50IZFYNzHDA0z7YPD_Fy4CzLqMlgBJj7JFjcCRnCwec0dgtRopNj5xepRGGtqczWYlKYHVpw2_lYEvSzYdhfUrqHle1Nhn8C-wP8UqZmtg/pIjW-bZvRoua9jIN6qxVJm1j6ASegUWDmWg2o5o4on4),2017-Ohio-7788,,Ohio District Court,Affirmed,,,checked,,,,,,Andi Khalaf,,Nicholas DeRose,,CJI,,13CR088148,,,16CA010926,,,,,,,,,,,,16,42,18,46,,,
594-Austin,checked,Fact-check complete,,1594,28199,Ninth District Court of Appeals,Ninth District Court of Appeals,Ohio,Summit,Summit  ,2017-09-27,2017,2017,Austin,Daniel D.,Daniel D. Austin,,2015,Sexual violence,Rape,Gross sexual imposition,,,Female,Life in prison with parole eligibility after 35. ,,,"Summation,Examination of witnesses","Austin argues that the prosecutor engaged in misconduct when he presented the testimony of Austin’s half-brother, who testified that Austin asked him to take a polygraph test on his behalf. He further argues that the prosecutor engaged in misconduct when he repeatedly commented on that same testimony during closing argument.",No error,"Because that testimony was admissible, the prosecutor did not engage in misconduct when he presented it or when he later referenced it in closing argument. As Austin has not pointed this Court to any instances of misconduct on the part of the prosecutor, his third assignment of error is overruled.",prosecutorial misconduct,,Donna J. Carr,,"Jennifer Hensal,Lynne S. Callahan",,Sherri Bevan Walsh,,Richard S. Kasay ,,,"Austin was convicted of various sex crimes against young girls from when he was between the ages of 10 and 19. He allegedly asked his stepbrother to take a polygraph in his place. The stepbrother then testified to this fact and the prosecutor presented this evidence. The defense objected, the court permitted it, and the prosecutor mentioned it in his closing argument as well. The court said it was admissible evidence and therefore there was no misconduct.",,2017-Ohio-7845.pdf (https://v5.airtableusercontent.com/v3/u/40/40/1745100000000/ld94bGLrI4P5oQEDV-pBGQ/vToD9fcCmydqwP0TIlo1ruiN1qRb6x4iF4_p69xjEnA8-xcdXCv7nGp1ioSG4La0hbA79Gab3lytuzAG9zAUWQzgCCjf-FI6cSOFJCdb7p7O15GxSz7YEdusvzUhKVdMH_iCdlv8trK-LY8yz1nKAqm7Y9qh0gZfWa9qkZAnsRU/evH1mOi-m5SC77CS_EXW-7Pc_7KCRsKzfpgTH0HHeqA),2017-Ohio-7845,,Ohio District Court,,,,,,,,,,Oishika Neogi,,Nicholas DeRose,Unsure how to best categorize the presentation of the testimony. I put it under witness examination.,CJI,,CR 2015 03 0889,,,28199,,,,,,,,,,,,12,25,12,26,,,
597-Krause,checked,Fact-check complete,,1597,2016-L-068,Eleventh District Court of Appeals,Eleventh District Court of Appeals,Ohio,Lake,Lake  ,2017-09-29,2017,2017,Krause,Richard A.,Richard A. Krause,,2015,,Assault,,,,,"180 days in jail with 90 days suspended for each of the two counts of assault, to be served concurrently.",,2015,Summation,Appellant argues the prosecutor engaged in misconduct during closing arguments by expressing a personal belief about the credibility of two of the state’s witnesses. Appellant maintains the statements prejudicially affected his substantial rights.,Did not reach error/conduct did not result in prejudice,"Given the strength of the evidence and the curative instructions, we do not find the comments were prejudicial.",,,,,,,,,,,,"Defendant assaulted multiple people at a bar. There were significant post-trial proceedings. A lot of the facts were about witnesses identifying the defendant. Court did not comment on the harm of the statements the prosecutor made, but clearly noted they did not find them to be prejudicial in the context of the rest of the evidence and the jury instructions. ",,2017-Ohio-7952.pdf (https://v5.airtableusercontent.com/v3/u/40/40/1745100000000/8SQvLMqghk4DrX2GwsrXnQ/_P8T5RPUlxmgSwVi8ltefLBH7zSaV9xHiZ8nNlcIbBcDE2niIUFVtGvPTTgu6bcxOt-s9SoIhJBmP3LXiLS2T8O_WdVphifiNZvDjuOsyOk3h2vYlRH7kIWDY0Jv3Mm3vtCoaZ6IO6dmyh6JYQ7nOhtGzbuEXasZ70ClQo3jlow/lRt4mWenph6zVglm3Q8SP1mKEYnniAU8xoIQO9fSWQ4),2017-Ohio-7952,,,,,,,,,,,,Andi Khalaf,,Nicholas DeRose,Review Holding.,CJI,,15 CRB 01044A&B,,,2016-L-068,,,,,,,,,,,,11,38,13,42,,,
