440-Riley,,Fact-check complete,,440,16CA29 ,Fourth Appellate district,Fourth District Court of Appeals,Ohio,Washington,Washington  ,2017-06-27,2017,2017,Riley,Dennis,Dennis Riley,White,2016,Sexual violence,sexual battery,,,,Female,1.5,,2016,Brady violation,"Appellant asserted that the state failed to disclose evidence in
violation of Brady v. Maryland, 373 U.S. 83, 83 S.Ct. 1194, 10 L.Ed.2d 215 (1963), and, thus, he could not have knowingly and intelligently entered his guilty plea. 

Appellant claimed that the state failed to disclose the existence of text messages between Officer Ellenwood and the victim.
 Appellant argued that the text messages contain evidence of an inappropriate, intimate relationship between Officer Ellenwood and the victim. Appellant asserted that the officer’s conduct undermines his credibility as a witness, as well as the credibility of the information that he obtained from the victim. Appellant contended that the officer likely used the relationship “to dissuade [the victim] from recanting her accusations.” 

Appellant thus argued that the evidence concerning Officer Ellenwood’s conduct would have allowed him to impeach the officer at trial and that the evidence constituted material evidence under Brady. Appellant argued that the state’s failure to disclose the evidence concerning Officer Ellenwood entitled him to withdraw his guilty plea and have his sentence vacated. ",No error,"The court found that the text messages reveal that “the officer counseled the victim toward recovery from [appellant]’s behavior, encouraging her to read books, watch movies, go to church, make good choices, seek counseling to help her address what she was experiencing.” The court did not find the material to contain any exculpatory evidence and that
it contains “marginally, if at all, impeachable” evidence. The court thus determined that none of the information constitutes relevant, material, or discoverable evidence.","Brady v. Maryland,Brady","ABELE, J. ",Peter B. Abele,,,Kevin Arthur Rings,Kevin A. Rings,Jeremy B. Wolfe,Jeremy Bryan Wolfe,William L. Burton George J. Cosenza,"William L. Burton,George J. Cosenza","The defendant is a former Marietta High School teacher and the student was 16-year-old. 
Information about a police officers inappropriate relationship via text message with the sexual battery victim wasn't disclosed to defense, who entered into a guilty plea. Because of the gulty plea and the not clearly exculpatory nature of the evidence, the judges ruled it wasn't brady. ",https://www.supremecourt.ohio.gov/rod/docs/pdf/4/2017/2017-Ohio-5819.pdf,2017-Ohio-5819.pdf (https://v5.airtableusercontent.com/v3/u/40/40/1745100000000/Whbf_tSGFnIhNSdhzCBXeQ/Lc4xab8Y75Brn5yXrzi-MH0qjfCzLTDL0QnladwpiIJbv3T2uS5OHM0A0BhCAu1a3Cn6g8Xu6oV9MLIo_iqoKjRKC5dI3qDDk-EBdXyyCUrXXBmE2yWdqVGU3UDtDylCSkmiDNPCUAcQ1sPwIXIA5Q/8Zsz2-Zgc-fYjezq4kiDBMLv1epFy_KIvXB7K0gWYyA),2017-Ohio-5819,,Ohio District Court,Affirmed,,10/19/2022,checked,,,,,Jake Belford Kincaid,Patricia Martinez Sastre,,Jake Kincaid,,CJI,,16CR000005,,,16CA29,,checked,http://cveaccess.washingtongov.org/eservices/;jsessionid=A6F33D8F95D03FAD5C3AC3B35939D655?x=K8SXqiccQd8emMGYUBVk7OI*ZcbhSZW1k5V1bFKxKbb-vQHd4lpbWwjzdg87kVZysjf4hP8Xnqc69STU22N1PA,"Kevin Rings, Jeremy B. Wolfe",I believe the prosecuting attorneys are the same at the appeal court. ,"Jeremy Bryan Wolfe,Kevin A. Rings",,,Cell Data,No error,Male,6,12,6,12,,,
441-Keith,,Fact-check complete,trial prosecutor,441,3-17-01 ,third appellate district,Third District Court of Appeals,Ohio,Crawford,Crawford  ,2017-06-26,2017,2017,Keith,Kevin A.,Kevin A. Keith,Black,1994,Murder,Aggravated murder,Attempted aggravated murder,,,Female,death,checked,1997,Brady violation,"{¶34} In Keith’s second assignment of error, he argues that the trial court
erroneously rejected Keith’s claim of a Brady violation in this case.

{¶36} On appeal, Keith claims that the State at least inadvertently suppressed Yezzo’s personnel file, that Yezzo’s file contained evidence favorable to Keith as it was impeachment evidence of a witness he characterized as “critical,” and he argues that absent Yezzo’s testimony the evidence linking Keith to the crime was minimal. ",Did not reach error/conduct did not result in prejudice,"{¶41} Over the years in his numerous appeals and post-conviction petitions Keith has challenged many aspects of his case and the evidence against him, but one fact remains clear, the evidence against Keith was simply overwhelming.

 Both at his trial and following his convictions Keith has strongly pursued the defense that another man committed the killings, specifically Rodney Melton. That theory was presented at trial, along with multiple
other individuals the defense contended were the potential killers. Rodney Melton, along with the others, actually testified for the jury to see and hear and the jury rejected the defense’s theories.

there is no reasonable possibility that the information contained in Yezzo’s file would have made any difference in the outcome of this case.
{¶42} For all of these reasons, Keith’s second assignment of error is
overruled. 
",Brady v. Maryland,"SHAW, J.",Stephen R. Shaw," PRESTON, P.J. and ZIMMERMAN, J","Vernon L. Preston,William R. Zimmerman",Matthew E. Crall,Matthew Crall,Robert J. Kidd,,"Rachel Troutman, Zachary M. Swisher",,"Defendant appeals a death sentence saying personell files that would have helped impeach witnesses were withheld. Judge says evidence of guilt was overwhelming and even if favourable it wouldn't have changed outcome of case.

Appellant history
This Court provided a history of Keith’s various attempts to overturn his conviction up to 2011 in State v.Keith, 3d Dist. Crawford No. 3-10-19, 2011-Ohio-407. The following is a brief summary of that history.
Keith filed his first petition for post-conviction relief in 1998, which was denied and the denial was affirmed on appeal. State v. Keith, 3d Dist. No. 3-98-05, 1998 WL 487044. In 1999 Keith filed a habeas corpus
petition in a federal district court presenting eight grounds for relief, which was denied in 2001. That habeas petition was appealed and denied on appeal by the Sixth Circuit. Keith v. Mitchell, 455 F.3d 662 (C.A.6,
2006). In 2004 Keith filed a second petition for postconviction relief, which was denied, appealed to this Court, and the denial was affirmed. In 2007, Keith filed a motion for leave to file a delayed motion for new
trial, which was denied, and he also filed a motion to reopen his direct appeal which was denied and affirmed by the Supreme Court of Ohio. State v. Keith, 119 Ohio St.3d 161, 2008-Ohio-3866. In 2008 Keith filed a
motion for an evidentiary hearing for his motion for new trial, which was denied and affirmed on appeal. 
State v. Keith, 3d Dist. Crawford No. 3-08-15, 2008-Ohio-6187. In 2009 the Sixth Circuit Court of Appeals
denied Keith’s request to have a second habeas corpus petition considered. Keith v. Bobby, 551 F.3d 555 (2009). In May of 2010, Keith filed another motion for leave to file a delayed motion for a new trial arguing that the State had improperly suppressed evidence. The trial court denied that motion and it was affirmed by this Court on appeal. State v. Keith, 3d Dist. Crawford No. 3-10-19, 2011-Ohio-407. In March of 2014, it appears that Keith filed another Habeas petition in United States District Court, which was transferred to the Sixth Circuit Court of Appeals due to being a successive petition",https://www.supremecourt.ohio.gov/rod/docs/pdf/3/2017/2017-Ohio-5488.pdf,2017-Ohio-5488.pdf (https://v5.airtableusercontent.com/v3/u/40/40/1745100000000/4fxIJJHOWIQvR2T4IaZMVw/QY-DKLU-dKjcIj_S51G-G13a6M8fIKPvRjxT4ma9jt6BZsdK3ip252HOiLtG3zQMte2gmm-78WkF3IbQSlh4gtgRqXiEYH6XrZUbjatnw1J4Jj6y4M9oYYhDjyLBa042ssq7YH9lrskTMw8dUMbk3w/u5wh2Hf5JWfTRtZ5InKmeT55gW9tAPs2qf1sM_iYlf8),2017-Ohio-5488,,Ohio District Court,Affirmed,,10/19/2022,checked,checked,Trial is before 2001,,,Jake Belford Kincaid,,,Jake Kincaid,,CJI,,94-CR-0042 ,,,3-17-01,,checked,http://clerk.crawford-co.org/cgi-bin/db2www.pgm/cpq.mbr/main?nuser=11:43:00,,"There is an interesting memorandum by the Ohio Prosecuting Attorneys Association in support of jurisdiction of the Supreme Court to review this trial (https://www.supremecourt.ohio.gov/pdf_viewer/pdf_viewer.aspx?pdf=831318.pdf&subdirectory=2017-1100\DocketItems&source=DL_Clerk), and more interestingly, and accusation blaming a former forensic analyst with Ohio’s Bureau of Criminal Investigation (BCI),  G. Michele Yezzo, of ""giving the answers the State wanted, and stretching the truth when her answers did not satisfy the State""(see. https://www.supremecourt.ohio.gov/pdf_viewer/pdf_viewer.aspx?pdf=828899.pdf&subdirectory=2017-1100\DocketItems&source=DL_Clerk)",,,,,Did not reach error/conduct did not result in prejudice,Male,21,36,24,41,,,
442-Dahms,,Fact-check complete,,442,13-16-16 ,Third Appellate District,Third District Court of Appeals,Ohio,Seneca,Seneca  ,2017-06-12,2017,2017,Dahms,Jeffrey B.,Jeffrey B. Dahms,White,2016,Other,Breaking and entering,"Bribing, witness intimidation, tampering with evidence",,,,8.5,,2016,Brady violation,"Appellant’s right to due process was violated as the State failed to
disclose exculpatory evidence it had in its possession.
{¶110} In his fourth assignment of error, Dahms argues that he was denied
due process of law because the State failed to disclose 181 jailhouse calls. It appears that Dahms is arguing that the State’s failure to disclose those jailhouse calls amounted to a “Brady violation.” ",No error,"{¶112} As an initial matter, Dahms’s reliance on Brady is misplaced because Brady involves the discovery of evidence after trial. [...] Dahms concedes that he received the jailhouse phone calls prior to the start of trial. (See Appellant’s Brief at 26). (See also Apr. 26, 2016 Tr., Vol. I, at 111). As such, no Brady violation exists.

¶120} Therefore, we conclude that the trial court did not abuse its discretion by preventing the State from using the jailhouse calls not provided through discovery as evidence—that is, imposing the least severe sanction that it determined to be consistent with the purpose of the rules of discovery.
{¶121} Dahms’s fourth assignment of error is overruled. ",Brady v. Maryland,"PRESTON, P.J. ",Vernon L. Preston,"SHAW, J., concurs.
WILLAMOWSKI, J","Stephen R. Shaw,John R. Willamowski",Stephanie J. Reed,Stephanie Jo Kiser (nee Reed),,,Jennifer Kahler ,Jennifer Kahler,"Jailhouse calls were ruled not to be brady material or a violation of crim R16 since defendant was aware of them and they were disclosed at trial. The court agrees to reverse the mandatory three-year term of post-release control related to his bribery conviction.

CO - Looks like he got out. Wasn't expected to be released until 2023, so it's unclear why he got released early. May be worth trying to verify there wasn't an additional appeal, etc. ",https://www.supremecourt.ohio.gov/rod/docs/pdf/3/2017/2017-Ohio-4221.pdf,2017-Ohio-4221.pdf (https://v5.airtableusercontent.com/v3/u/40/40/1745100000000/1-gokJKhUTH_uAf34inepA/TqEZ7vd6lPsT-TpqSdzaX0hxHmt10atdY-DDN3S9MPuA4-E3bwhZH0Sv76idGXUTobPZfGcpc_TsEg6ldG5dyAU5AoHEm-m5Y6cZ4tnFMClQbzK8tUOypXk12CRcI2HLSBjPNie1pdl1aYxDi6hnZA/k6S53ZfSOZxYiq4_-ds5Hqo-MBWmBwAkvKU_OD0-VhU),2017-Ohio-4221,,Ohio District Court,Affirmed in part / Reversed in part,,10/19/2022,checked,,,,,Jake Belford Kincaid,Patricia Martinez Sastre,,Jake Kincaid,,CJI,,15-CR-0163 ,,,13-16-16,,checked,https://senecacountyclerk.org/recordSearch.php?k=case7404sF19eb5t7sPXiqP5XG9k1liEInD3LxfGqusNGZ4525036996980054667094962922090982829245292161060654188382439375107110842082753175_8 ,Stephanie Kiser ,,Stephanie Jo Kiser (nee Reed),,,Cell Data,No error,Male,60,110,67,120,,,
443-Owens,,Fact-check complete,,443, 9-16-40 ,Third Appellate District,Third District Court of Appeals,Ohio,Marion,Marion,2017-05-01,2017,2017,Owens,Tommy,Tommy Owens,Black,2016,Drugs,Possession of Cocaine,"Trafficking in cocaine.
",,,,5 years,,2016,"Discovery,Brady violation","{¶25} In Owen’s third assignment of error, Owens contends that the trial
court erred in failing to either dismiss the case or grant a mistrial due to a consistent pattern of discovery violations by the State. 

Applying Crim.R. 16 and the Brady requirements to the facts presented to us for review, we will discuss each alleged discovery violation in turn. 
...

{¶28} Owens contends that Davon Meggison’s (“Meggison”) criminal
history was not properly disclosed. Specifically, Owens asserts that the prosecution failed to disclose that Meggison was arrested out of the same incident involving Owens; that Meggison had been arrested on a probation violation; and that Meggison was currently under indictment as well.

{¶29} Owens asserts that the failure to disclose the criminal history of
Meggison materially affected his attorney’s ability to adequately prepare and present a proper defense. However, this court has consistently determined that materiality does not refer to the defendant’s ability to prepare for trial. State v. Wangler, 3rd Dist. Allen No. 1-11-18, 2012-Ohio-4878, ¶ 115, quoting United States v. Agurs, 427 U.S. 97, 113, 96 S.Ct. 2392 (1976), holding modified by United States v. Bagley, 473 U.S. 667, 105 S.Ct. 3375 (1985). Moreover, Owens has put forth no assertion that the undisclosed evidence in regards to Meggison’s criminal history was favorable to Owens’ case, let alone material to Owens’ conviction.
Furthermore, Meggison’s criminal history was discussed, in part, during his testimony

{¶30} During the course of the trial, Owens’ attorney discovered that
Shaquille Smith (“Smith”), a witness for the State, had reached a plea deal with the State in exchange for his testimony against Owens.

Upon notice of this plea deal, the trial court recessed the jury and independently investigated the allegation. It was determined that Smith was charged with Permitting Drug Abuse, a felony of the fifth degree, in violation of R.C. 2925.13, arising from the February 9, 2016 incident involving Owens. The State advised the trial court it had a plea agreement with Smith, and that such agreement had not been disclosed to defense counsel. 

{¶34} Lastly, Owens’ contends that the State failed to comply with the rules of discovery by not disclosing the address of Keese, its confidential informant.",Harmless error,"Moreover, Owens has put forth no assertion that the undisclosed evidence in regards to Meggison’s criminal history was favorable to Owens’ case, let alone material to Owens’ conviction.
Furthermore, Meggison’s criminal history was discussed, in part, during his testimony. There is nothing in the record to indicate that Meggison’s full criminal history, if disclosed, would have impacted the verdict in light of Owen’s admissions of guilt to three of the four charges. ....

DISCOVERY

with respect to the failure of the State to disclose its recorded
statement of Smith under Crim.R. 16(L)(1), the trial court permitted Owens’ attorney ample review of the tape prior to concluding cross examination which resulted in greater questioning of Smith. The trial court properly interceded and regulated the discovery process consistent with the rules of discovery, which resulted in the impeachment of Smith. We find the trial court’s curative measures were sufficient to resolve any potential prejudice to Owens. 
..
While not condoning the multiple discovery errors committed by the
State in this case, we find that there was no material discovery violation that would have changed the jury’s verdict in light of Owens’ admissions and the evidence presented at trial. Accordingly, we overrule the third assignment of error. ",Brady v. Maryland,Zimmerman,William R. Zimmerman,"PRESTON, P.J. concurs.
SHAW, J., concurs in Judgment Only","Vernon L. Preston,Stephen R. Shaw",Kevin P. Collins ,Kevin P. Collins,none,,Robert C. Nemo,Robert C. Nemo,Multiple discovery errors occurred but none could be showed to have prejudicially impacted the trial. ,https://www.supremecourt.ohio.gov/rod/docs/pdf/3/2017/2017-Ohio-2590.pdf,2017-Ohio-2590.pdf (https://v5.airtableusercontent.com/v3/u/40/40/1745100000000/E12sbU4feAJ1ShoeBCvghw/k5Bj16JDuCrfMK6TcwUbXhXX5l6F8afE8XSYbuwehnVPF1kaUaTDByRhcMtx3VbHJ8BDqod-ccfDZmF7Pv3hkrgQ_s_F90eZTCnMUou-WUdTdv4-yeO1k3Q0zjDvNp6tcWiIBOYw1qr9eXRIdZWCeg/JLiTSTqAlirXzSGEqwEHBBLdkfK6d0Bz-hOuEqAIap8),2017-Ohio-2590,,Ohio District Court,Affirmed,,12/9/2022,checked,,,,,Jake Belford Kincaid,Cameron Oakes,CO - agree that this case contains multiple harmless discovery errors. ,Jake Kincaid,,CJI,State v. Owens,16-CR-0085 ,Brady v. Maryland ,Brady v. Maryland ,9-16-40,,,,,"Attorney information is not posted on Marion county public records

CO - tried to pull trial document link but the county's web pages appeared to be down. I couldn't get any of them to load. ",,,,Other,No error,Male,13,25,18,35,,,Trial attorney doesn't appear on Marion County public records
444-Berry,,Fact-check complete,,444,"16AP-659, 16AP-660",Tenth Appellate District,Tenth District Court of Appeals,Ohio,Franklin,Franklin  ,2017-04-25,2017,2017,Berry,Robert,Robert Berry,White,2016,Sexual violence,Rape,"Kidnapping,conspiracy",,,Female,12,,2016,Brady violation,"[2.] THE TRIAL COURT ERRED IN NOT PERMITTING
DEFENSE COUNSEL TO REVIEW RECORDS IN CAMERA
DEPRIVING APPELLANT OF DUE PROCESS OF LAW AS
GUARANTEED BY THE FIFTH AND FOURTEENTH
AMENDMENT TO THE UNITED STATES CONSTITUTION
AND COMPARABLE PROVISIONS OF THE OHIO
CONSTITUTION. ",No error,"Berry's motion gave the trial court very little information. It did not explain
what Berry expected or hoped to find in such records. 

None of these assertions amounts to a ""plausible showing"" that the evidence sought was favorable and material to Berry's defense such that the prosecutor would have had an obligation to obtain it and surrender it to the court for inspection.

Berry also did not identify who possessed the records that he sought to have reviewed; nor did he state that such records were within the knowledge of persons acting on the government's behalf. It is not clear that a Brady or Ritchie disclosure was even the proper vehicle for examining any such records (rather than, for example, a subpoena). See, e.g., Crim.R. 16(E)(1); Crim.R. 17. ",Brady v. Maryland,"BRUNNER, J.",Jennifer Brunner,"KLATT and SADLER, JJ.","William A. Klatt,Lisa L. Sadler",Ron O'Brien,Ron O'Brien,Sheryl L. Prichard,"""Sheryl Lynn Prichard (formerly Sheryl Cook, Sheryl Edelsberg)""","Yavitch & Palmer, Co., L.P.A., Jeffery A. Linn, II","""Jeffery A. Linn, II""",,https://www.supremecourt.ohio.gov/rod/docs/pdf/10/2017/2017-Ohio-1529.pdf,2017-Ohio-1529.pdf (https://v5.airtableusercontent.com/v3/u/40/40/1745100000000/1ySHSvimvsSiOrzzPf0I9A/w8E91kYLMc1KPlfw1WJTeV6LiIJXFClxZM5NjHBagWT4hLaYfPLCxb3ma0L0sFS_pgYAuUeKDXaJH4xiW8hr3f_P41_B5JSzILa-M9l5vNAX_5V4oQoMy_4RpgTvPF8CJh0R8onFvAIn9D8J4tIJjw/-fG7jtksAtvS_JRIS4HgMnknGdYxV79wQNt9YijykqI),2017-Ohio-1529,,Ohio District Court,Affirmed,,10/19/2022,checked,,,,,Jake Belford Kincaid,Patricia Martinez Sastre,,Jake Kincaid,,CJI,,"14CR-6374, 16CR-3600",,,"16AP-659, 16AP-660",,checked,https://fcdcfcjs.co.franklin.oh.us/CaseInformationOnline/caseSearch?Pf9HlI7lxfNelDJ2thST,BEAU D WENGER,,Beau David Wenger,,,,No error,Male,24,51,24,51,,,
445-Parsons,,Fact-check complete,trial prosecutor name,445,7-16-08 ,Third Appellate District,Third District Court of Appeals,Ohio,Henry,Henry  ,2017-04-10,2017,2017,Parsons,Cullen A.,Cullen Parsons,White,2016,Assault,Felonious Assault,"firearm specification, forfeiture specification, improperly handling firearms in a motor vehicle, indictment",,,Male,12,,2016,Brady violation,"{¶75} In his third assignment of error, Parsons argues that he was denied due process of law because the State failed to disclose “[t]wo pieces of material, exculpatory evidence”—namely, “Kern’s testimony that he told officers about the ‘unique’ noise that Parson’s [sic] Honda made, and the conversation between officers and Aisya Kynard when officers seized her phone.” (Appellant’s Brief at 25). Parsons argues that the State’s failure to disclose that evidence amounted to a “Brady violation.” ",No error,"{¶77} As an initial matter, Parsons’s reliance on Brady is misplaced because Brady involves the discovery of evidence after trial

{¶82} As an initial matter, we note that the principles of Youngblood may be inapplicable to Parsons’s argument since there is no evidence in the record that Kern identified the Honda Civic by its unique sound to law enforcement.. As in Brown, Parsons is alleging that law enforcement failed to collect Kern’s statement in a report or recorded statement of Kern. See id. However, we will assume without deciding that Parsons’s argument falls within the meaning of the “failure to preserve” evidence under Youngblood.

{¶83} Even assuming that Kern’s statement is potentially useful evidence,
Parsons failed to prove that it was not preserved in bad faith. There is no evidence in the record that Kern stated to law enforcement that he identified the Honda Civic as belonging to Parsons based on its unique sound. Stated differently, there is no evidence in the record that law enforcement, or the State, failed to disclose Kern’s statement. Indeed, our review of the record reveals that this evidence was first introduced at trial during Kern’s direct examination. (Mar. 7-8, 2016 Tr. at 18).
 For these reasons, Parsons failed to prove that law enforcement acted in bad faith. As such, there is no due process violation.
{¶84} Parsons’s third assignment of error is overruled. ",Brady v. Maryland,PRESTON,Vernon L. Preston,WILLAMOWSKI and SHAW,,Hawken Flanagan,Hawken Flanagan,,,"Karin L. Coble, Tim A. Dugan ","Karin L. Coble,Tim A. Dugan",Improperly applied Brady allegation is shot down. The allegation to merge offenses is well-taken. ,https://www.supremecourt.ohio.gov/rod/docs/pdf/3/2017/2017-Ohio-1315.pdf,2017-Ohio-1315.pdf (https://v5.airtableusercontent.com/v3/u/40/40/1745100000000/f-SkGx0lie_psaRq6r8kHg/jSrl8g7aRJzx8stpnrjIhcnTP9H3lq3tfjEGGnlH1Qz6EjlYxBL94fYNpFExLogYD1ioco6CuJKnLQkkjiQgnMkK9jHajwUSDqN7kj_4nxTR_1ruOyKJavw6S5nHes21-OiAuhCUlw7BRGUV9thLcw/hyy-Sxn-vrmAmN3uiPjGzf4fbnU8s7v6QSTa2KTQ9pE),2017-Ohio-1315,,Federal District Court,Affirmed in part / Reversed in part,,10/19/2022,checked,,,,,Jake Belford Kincaid,Patricia Martinez Sastre,,Jake Kincaid,,CJI,,15-CR-0082 ,,,7-16-08,,,,,,,,,,No error,Male,46,75,50,83,,,
446-Vandersspool,,Fact-check complete,trial prosecutor,446,"104444, 104512",Eight Appellate District,Eighth District Court of Appeals,Ohio,Cuyahoga,Cuyahoga  ,2017-03-09,2017,2017,Vandersspool,Robin A.,Robin Vandersspool,Other,2016,Murder,Manslaughter,aggravated robbery,,,Male,27 years,,2016,Brady violation,"II. The state improperly and unconstitutionally withheld exculpatory
impeachment evidence from the defense in violation of the discovery rules and its obligation under Brady v. Maryland. 

{¶10} In his second assignment of error, appellant asserts that the state
impermissibly withheld information regarding the criminal records of several witnesses. He argues that he could have used these records on
cross-examination to impeach these witnesses
Appellant argues that he was not fully apprised of the case against him, which made his plea invalid.",Did not reach error/conduct did not result in prejudice,"{¶16} Appellant has not provided this court with the necessary information to determine this assignment of error in his favor. App.R. 9(B). Appellant points to things outside the record, even considering the state’s supplement. Further, appellant has not alleged how the failure to provide any of the criminal backgrounds of certain witnesses
prejudiced him. He baldly asserts that the state’s failure resulted in prejudice. He does not explain how the lack of criminal histories of certain witnesses impacted his ability to properly address the merits of the state’s case against him. Therefore, this court overrules the assigned error. 
",Brady v. Maryland,FRANK D. CELEBREZZE,Unnamed record,"MELODY J. STEWART, SEAN C. GALLAGHER, (SEE SEPARATE CONCURRING OPINION)",,Michael C. O’Malley,Michael C. O'Malley,Anna M. Faraglia ,Anna Faraglia,Edward M. Heindel ,Edward M. Heindel,Prosecutors provided criminal histories of 7 out of 91 possible witnesses. The defendant pleaded guilty and tries to argue this was invalid due to the non disclosure. The court can't determine if there was or not error.,https://www.supremecourt.ohio.gov/rod/docs/pdf/8/2017/2017-Ohio-962.pdf,2017-Ohio-962.pdf (https://v5.airtableusercontent.com/v3/u/40/40/1745100000000/nwjqnUDxJQJHi1JY-mlEeg/ECoZd8UkjgRdaELDOqOvJmdQgyTm7WIDcxwz98gwqzwg9x5ac29sWAkewjIQQkrntO0EBhb5hOsE2UnuuTcYC3U-4k2gUnBm3pVqnEJTExw1H1E-jnMivlHqtLbB6HKE8Dlke9AHyGKSYYrRkisV_A/Pic2xQl23KRZ_1IpJNxIXYrthRSmQlQAqvmJrQDX6_U),2017-Ohio-962,,Ohio District Court,Affirmed,,10/18/2022,checked,,,,,Jake Belford Kincaid,Patricia Martinez Sastre,,Jake Kincaid,,CJI,,CR-14-588471-A,,,"104444, 104512",,checked,https://cpdocket.cp.cuyahogacounty.us/CR_CaseInformation_Summary.aspx?q=M254QRkWBVwGgcPKTGm3BA2,,"His name is written as Robbin (not Robin) on the original trial. His race is considered to be Hispanic. One of his lawyers back then, Ralph de France, seems to be involved in trying to fix the outcome of some trials. See: https://www.cleveland.com/court-justice/2015/11/accused_cleveland_drug_kingpin.html ","Anna Faraglia,Kelly Nicole Mason",,,Other,Did not reach error/conduct did not result in prejudice,Male,7,10,9,16,,,
